CVE ID,Description,Severity,Attack Complexity,Attack Vector,CWE ID,References,Attack Type,Mitigation Strategy
CVE-2023-33184,"Nextcloud Mail is a mail app in Nextcloud. A blind SSRF attack allowed to send GET requests to services running in the same web server. It is recommended that the Mail app is update to version 3.02, 2.2.5 or 1.15.3.

",LOW,LOW,CVSS:3.1/AV:N/AC:L/PR:L/UI:R/S:U/C:L/I:N/A:N,CWE-918,"https://github.com/nextcloud/mail/pull/8275, https://github.com/nextcloud/security-advisories/security/advisories/GHSA-8gph-9895-w564, https://hackerone.com/reports/1913095, https://github.com/nextcloud/mail/pull/8275, https://github.com/nextcloud/security-advisories/security/advisories/GHSA-8gph-9895-w564, https://hackerone.com/reports/1913095",Blind SSRF,"Restrict internal network access, validate user input, use allowlists for URLs"
CVE-2023-1938,"The WP Fastest Cache WordPress plugin before 1.1.5 does not have CSRF check in an AJAX action, and does not validate user input before using it in the wp_remote_get() function, leading to a Blind SSRF issue",HIGH,LOW,CVSS:3.1/AV:N/AC:L/PR:N/UI:R/S:U/C:H/I:H/A:H,N/A,"https://wpscan.com/vulnerability/92b1c6d8-51db-46aa-bde6-abdfb091aab5, https://wpscan.com/vulnerability/92b1c6d8-51db-46aa-bde6-abdfb091aab5",Blind SSRF,"General SSRF Mitigation: Validate and sanitize all URLs, restrict network access, and enforce security controls."
CVE-2023-32750,"Pydio Cells through 4.1.2 allows SSRF. For longer running processes, Pydio Cells allows for the creation of jobs, which are run in the background. The job ""remote-download"" can be used to cause the backend to send a HTTP GET request to a specified URL and save the response to a new file. The response file is then available in a user-specified folder in Pydio Cells.",MEDIUM,LOW,CVSS:3.1/AV:N/AC:L/PR:L/UI:N/S:U/C:H/I:N/A:N,CWE-918,"https://www.redteam-pentesting.de/advisories/rt-sa-2023-005/, https://www.redteam-pentesting.de/en/advisories/-advisories-publicised-vulnerability-analyses, https://www.redteam-pentesting.de/advisories/rt-sa-2023-005/, https://www.redteam-pentesting.de/en/advisories/-advisories-publicised-vulnerability-analyses",External SSRF,"Restrict internal network access, validate user input, use allowlists for URLs"
CVE-2023-35133,"An issue in the logic used to check 0.0.0.0 against the cURL blocked hosts lists resulted in an SSRF risk. This flaw affects Moodle versions 4.2, 4.1 to 4.1.3, 4.0 to 4.0.8, 3.11 to 3.11.14, 3.9 to 3.9.21 and earlier unsupported versions.",HIGH,LOW,CVSS:3.1/AV:N/AC:L/PR:N/UI:N/S:U/C:H/I:N/A:N,CWE-918,"https://bugzilla.redhat.com/show_bug.cgi?id=2214373, https://lists.fedoraproject.org/archives/list/package-announce%40lists.fedoraproject.org/message/7A72KX4WU6GK2CX4TKYFGFASPKOEOJFC/, https://lists.fedoraproject.org/archives/list/package-announce%40lists.fedoraproject.org/message/I5QAEAGJ44NVXLAJFJXKARKC45OGEDXT/, https://moodle.org/mod/forum/discuss.php?d=447831, https://bugzilla.redhat.com/show_bug.cgi?id=2214373, https://lists.fedoraproject.org/archives/list/package-announce%40lists.fedoraproject.org/message/7A72KX4WU6GK2CX4TKYFGFASPKOEOJFC/, https://lists.fedoraproject.org/archives/list/package-announce%40lists.fedoraproject.org/message/I5QAEAGJ44NVXLAJFJXKARKC45OGEDXT/, https://moodle.org/mod/forum/discuss.php?d=447831",External SSRF,"Restrict internal network access, validate user input, use allowlists for URLs"
CVE-2023-36661,"Shibboleth XMLTooling before 3.2.4, as used in OpenSAML and Shibboleth Service Provider, allows SSRF via a crafted KeyInfo element. (This is fixed in, for example, Shibboleth Service Provider 3.4.1.3 on Windows.)",HIGH,LOW,CVSS:3.1/AV:N/AC:L/PR:N/UI:N/S:U/C:N/I:N/A:H,CWE-918,"https://shibboleth.net/community/advisories/secadv_20230612.txt, https://www.debian.org/security/2023/dsa-5432, https://shibboleth.net/community/advisories/secadv_20230612.txt, https://www.debian.org/security/2023/dsa-5432",External SSRF,"Restrict internal network access, validate user input, use allowlists for URLs"
CVE-2021-42079,An authenticated administrator is able to prepare an alert that is able to execute an SSRF attack. This is exclusively with POST requests.,MEDIUM,LOW,CVSS:3.1/AV:N/AC:L/PR:H/UI:R/S:C/C:H/I:N/A:N,CWE-918,"https://cisrt.divd.nl/DIVD-2021-00020/, https://csirt.divd.nl/CVE-2021-42079, https://www.osnexus.com/products/software-defined-storage, https://www.wbsec.nl/osnexus, https://csirt.divd.nl/CVE-2021-42079, https://www.divd.nl/DIVD-2021-00020, https://www.osnexus.com/products/software-defined-storage, https://www.wbsec.nl/osnexus",External SSRF,"Restrict internal network access, validate user input, use allowlists for URLs"
CVE-2023-3577,"Mattermost fails to properly restrict requests tolocalhost/intranet during the interactive dialog, which could allow an attacker to perform a limitedblind SSRF.

",LOW,HIGH,CVSS:3.1/AV:N/AC:H/PR:L/UI:N/S:C/C:L/I:N/A:N,CWE-918,"https://mattermost.com/security-updates, https://mattermost.com/security-updates",Internal SSRF,"Restrict internal network access, validate user input, use allowlists for URLs"
CVE-2023-38490,"Kirby is a content management system. A vulnerability in versions prior to 3.5.8.3, 3.6.6.3, 3.7.5.2, 3.8.4.1, and 3.9.6 only affects Kirby sites that use the `Xml` data handler (e.g. `Data::decode($string, 'xml')`) or the `Xml::parse()` method in site or plugin code. The Kirby core does not use any of the affected methods.

XML External Entities (XXE) is a little used feature in the XML markup language that allows to include data from external files in an XML structure. If the name of the external file can be controlled by an attacker, this becomes a vulnerability that can be abused for various system impacts like the disclosure of internal or confidential data that is stored on the server (arbitrary file disclosure) or to perform network requests on behalf of the server (server-side request forgery, SSRF).

Kirby's `Xml::parse()` method used PHP's `LIBXML_NOENT` constant, which enabled the processing of XML external entities during the parsing operation. The `Xml::parse()` method is used in the `Xml` data handler (e.g. `Data::decode($string, 'xml')`). Both the vulnerable method and the data handler are not used in the Kirby core. However they may be used in site or plugin code, e.g. to parse RSS feeds or other XML files. If those files are of an external origin (e.g. uploaded by a user or retrieved from an external URL), attackers may be able to include an external entity in the XML file that will then be processed in the parsing process. Kirby sites that don't use XML parsing in site or plugin code are *not* affected.

The problem has been patched in Kirby 3.5.8.3, 3.6.6.3, 3.7.5.2, 3.8.4.1, and 3.9.6. In all of the mentioned releases, the maintainers have removed the `LIBXML_NOENT` constant as processing of external entities is out of scope of the parsing logic. This protects all uses of the method against the described vulnerability.",MEDIUM,HIGH,CVSS:3.1/AV:N/AC:H/PR:N/UI:N/S:C/C:H/I:N/A:N,CWE-611,"https://github.com/getkirby/kirby/commit/277b05662d2b67386f0a0f18323cf68b30e86387, https://github.com/getkirby/kirby/releases/tag/3.5.8.3, https://github.com/getkirby/kirby/releases/tag/3.6.6.3, https://github.com/getkirby/kirby/releases/tag/3.7.5.2, https://github.com/getkirby/kirby/releases/tag/3.8.4.1, https://github.com/getkirby/kirby/releases/tag/3.9.6, https://github.com/getkirby/kirby/security/advisories/GHSA-q386-w6fg-gmgp, https://github.com/getkirby/kirby/commit/277b05662d2b67386f0a0f18323cf68b30e86387, https://github.com/getkirby/kirby/releases/tag/3.5.8.3, https://github.com/getkirby/kirby/releases/tag/3.6.6.3, https://github.com/getkirby/kirby/releases/tag/3.7.5.2, https://github.com/getkirby/kirby/releases/tag/3.8.4.1, https://github.com/getkirby/kirby/releases/tag/3.9.6, https://github.com/getkirby/kirby/security/advisories/GHSA-q386-w6fg-gmgp",Internal SSRF,Disable XML external entity (XXE) processing to prevent SSRF exploitation
CVE-2023-1977,"The Booking Manager WordPress plugin before 2.0.29 does not validate URLs input in it's admin panel or in shortcodes for showing events from a remote .ics file, allowing an attacker with privileges as low as Subscriber to perform SSRF attacks on the sites internal network.",HIGH,LOW,CVSS:3.1/AV:N/AC:L/PR:L/UI:N/S:U/C:H/I:H/A:H,N/A,"https://wpscan.com/vulnerability/842f3b1f-395a-4ea2-b7df-a36f70e8c790, https://wpscan.com/vulnerability/842f3b1f-395a-4ea2-b7df-a36f70e8c790",Internal SSRF,"General SSRF Mitigation: Validate and sanitize all URLs, restrict network access, and enforce security controls."
CVE-2023-40033,"Flarum is an open source forum software. Flarum is affected by a vulnerability that allows an attacker to conduct a Blind Server-Side Request Forgery (SSRF) attack or disclose any file on the server, even with a basic user account on any Flarum forum. By uploading a file containing a URL and spoofing the MIME type, an attacker can manipulate the application to execute unintended actions. The vulnerability is due to the behavior of the `intervention/image` package, which attempts to interpret the supplied file contents as a URL, which then fetches its contents. This allows an attacker to exploit the vulnerability to perform SSRF attacks, disclose local file contents, or conduct a blind oracle attack. This has been patched in Flarum version 1.8.0. Users are advised to upgrade. Users unable to upgrade may disable PHP's `allow_url_fopen` which will prevent the fetching of external files via URLs as a temporary workaround for the SSRF aspect of the vulnerability.",HIGH,LOW,CVSS:3.1/AV:N/AC:L/PR:L/UI:N/S:U/C:H/I:L/A:N,CWE-918,"https://github.com/flarum/framework/commit/d1059c1cc79fe61f9538f3da55e8f42abbede570, https://github.com/flarum/framework/security/advisories/GHSA-67c6-q4j4-hccg, https://github.com/flarum/framework/commit/d1059c1cc79fe61f9538f3da55e8f42abbede570, https://github.com/flarum/framework/security/advisories/GHSA-67c6-q4j4-hccg",Blind SSRF,"Restrict internal network access, validate user input, use allowlists for URLs"
CVE-2023-40743,"** UNSUPPORTED WHEN ASSIGNED ** When integrating Apache Axis 1.x in an application, it may not have been obvious that looking up a service through ""ServiceFactory.getService"" allows potentially dangerous lookup mechanisms such as LDAP. When passing untrusted input to this API method, this could expose the application to DoS, SSRF and even attacks leading to RCE.

As Axis 1 has been EOL we recommend you migrate to a different SOAP engine, such as Apache Axis 2/Java. As a workaround, you may review your code to verify no untrusted or unsanitized input is passed to ""ServiceFactory.getService"", or by applying the patch from  https://github.com/apache/axis-axis1-java/commit/7e66753427466590d6def0125e448d2791723210 . The Apache Axis project does not expect to create an Axis 1.x release fixing this problem, though contributors that would like to work towards this are welcome.",CRITICAL,LOW,CVSS:3.1/AV:N/AC:L/PR:N/UI:N/S:U/C:H/I:H/A:H,CWE-20,"https://github.com/apache/axis-axis1-java/commit/7e66753427466590d6def0125e448d2791723210, https://lists.apache.org/thread/gs0qgk2mgss7zfhzdd6ftfjvm4kp7v82, https://lists.debian.org/debian-lts-announce/2023/10/msg00025.html, https://github.com/apache/axis-axis1-java/commit/7e66753427466590d6def0125e448d2791723210, https://lists.apache.org/thread/gs0qgk2mgss7zfhzdd6ftfjvm4kp7v82, https://lists.debian.org/debian-lts-announce/2023/10/msg00025.html",External SSRF,Implement strict input validation to prevent unexpected behavior
CVE-2023-36388,"Improper REST API permission in Apache Superset up to and including 2.1.0 allows for an authenticated Gamma users to test network connections, possible SSRF.

",MEDIUM,LOW,CVSS:3.1/AV:N/AC:L/PR:L/UI:N/S:U/C:L/I:N/A:N,CWE-918,"https://lists.apache.org/thread/ccmjjz4jp17yc2kcd18qshmdtf7qorfs, https://lists.apache.org/thread/ccmjjz4jp17yc2kcd18qshmdtf7qorfs",External SSRF,"Restrict internal network access, validate user input, use allowlists for URLs"
CVE-2023-42439,"GeoNode is an open source platform that facilitates the creation, sharing, and collaborative use of geospatial data. A SSRF vulnerability exists starting in version 3.2.0, bypassing existing controls on the software. This can allow a user to request internal services for a full read SSRF, returning any data from the internal network. The application is using a whitelist, but the whitelist can be bypassed. The bypass will trick the application that the first host is a whitelisted address, but the browser will use `@` or `%40` as a credential to the host geoserver on port 8080, this will return the data to that host on the response. Version 4.1.3.post1 is the first available version that contains a patch.",HIGH,LOW,CVSS:3.1/AV:N/AC:L/PR:N/UI:N/S:U/C:H/I:N/A:N,CWE-918,"https://github.com/GeoNode/geonode/commit/79ac6e70419c2e0261548bed91c159b54ff35b8d, https://github.com/GeoNode/geonode/releases/tag/4.1.3, https://github.com/GeoNode/geonode/security/advisories/GHSA-pxg5-h34r-7q8p, https://github.com/GeoNode/geonode/commit/79ac6e70419c2e0261548bed91c159b54ff35b8d, https://github.com/GeoNode/geonode/releases/tag/4.1.3, https://github.com/GeoNode/geonode/security/advisories/GHSA-pxg5-h34r-7q8p",Internal SSRF,"Restrict internal network access, validate user input, use allowlists for URLs"
CVE-2023-44384,"Discourse-jira is a Discourse plugin allows Jira projects, issue types, fields and field options will be synced automatically. An administrator user can make an SSRF attack by setting the Jira URL to an arbitrary location and enabling the `discourse_jira_verbose_log` site setting. A moderator user could manipulate the request path to the Jira API, allowing them to perform arbitrary GET requests using the Jira API credentials, potentially with elevated permissions, used by the application. ",MEDIUM,LOW,CVSS:3.1/AV:N/AC:L/PR:H/UI:N/S:C/C:L/I:N/A:N,CWE-691,"https://github.com/discourse/discourse-jira/commit/8a2d3ad228883199fd5f081cc93d173c88e2e48f, https://github.com/discourse/discourse-jira/pull/50, https://github.com/discourse/discourse-jira/security/advisories/GHSA-pmv5-h2x6-35fh, https://github.com/discourse/discourse-jira/commit/8a2d3ad228883199fd5f081cc93d173c88e2e48f, https://github.com/discourse/discourse-jira/pull/50, https://github.com/discourse/discourse-jira/security/advisories/GHSA-pmv5-h2x6-35fh",External SSRF,Ensure security mechanisms cannot be bypassed easily
CVE-2023-39854,"The web interface of ATX Ucrypt through 3.5 allows authenticated users (or attackers using default credentials for the admin, master, or user account) to include files via a URL in the /hydra/view/get_cc_url url parameter. There can be resultant SSRF.",MEDIUM,LOW,CVSS:3.1/AV:N/AC:L/PR:L/UI:N/S:U/C:H/I:N/A:N,CWE-918,"https://wiki.notveg.ninja/blog/CVE-2023-39854/, https://wiki.notveg.ninja/blog/CVE-2023-39854/",External SSRF,"Restrict internal network access, validate user input, use allowlists for URLs"
CVE-2023-45152,"Engelsystem is a shift planning system for chaos events. A Blind SSRF in the ""Import schedule"" functionality makes it possible to perform a port scan against the local environment. This vulnerability has been fixed in commit ee7d30b33. If a patch cannot be deployed, operators should ensure that no HTTP(s) services listen on localhost and/or systems only reachable from the host running the engelsystem software. If such services are necessary, they should utilize additional authentication.",LOW,LOW,CVSS:3.1/AV:L/AC:L/PR:H/UI:R/S:U/C:L/I:N/A:N,CWE-918,"https://github.com/engelsystem/engelsystem/commit/ee7d30b33935ea001705f438fec8ffd05734f295, https://github.com/engelsystem/engelsystem/security/advisories/GHSA-jj9g-75wf-6ppf, https://github.com/engelsystem/engelsystem/commit/ee7d30b33935ea001705f438fec8ffd05734f295, https://github.com/engelsystem/engelsystem/security/advisories/GHSA-jj9g-75wf-6ppf",Internal SSRF,"Restrict internal network access, validate user input, use allowlists for URLs"
CVE-2023-46229,LangChain before 0.0.317 allows SSRF via document_loaders/recursive_url_loader.py because crawling can proceed from an external server to an internal server.,HIGH,LOW,CVSS:3.1/AV:N/AC:L/PR:N/UI:R/S:U/C:H/I:H/A:H,CWE-918,"https://github.com/langchain-ai/langchain/commit/9ecb7240a480720ec9d739b3877a52f76098a2b8, https://github.com/langchain-ai/langchain/pull/11925, https://github.com/langchain-ai/langchain/commit/9ecb7240a480720ec9d739b3877a52f76098a2b8, https://github.com/langchain-ai/langchain/pull/11925",Internal SSRF,"Restrict internal network access, validate user input, use allowlists for URLs"
CVE-2023-25753,"
There exists an SSRF (Server-Side Request Forgery) vulnerability located at the /sandbox/proxyGateway endpoint. This vulnerability allows us to manipulate arbitrary requests and retrieve corresponding responses by inputting any URL into the requestUrl parameter.

Of particular concern is our ability to exert control over the HTTP method, cookies, IP address, and headers. This effectively grants us the capability to dispatch complete HTTP requests to hosts of our choosing.

This issue affects Apache ShenYu: 2.5.1.

Upgrade to Apache ShenYu 2.6.0 or apply patch https://github.com/apache/shenyu/pull/4776 .

",MEDIUM,LOW,CVSS:3.1/AV:N/AC:L/PR:N/UI:N/S:U/C:L/I:L/A:N,CWE-918,"https://lists.apache.org/thread/chprswxvb22z35vnoxv9tt3zknsm977d, https://lists.apache.org/thread/chprswxvb22z35vnoxv9tt3zknsm977d",External SSRF,"Restrict internal network access, validate user input, use allowlists for URLs"
CVE-2023-32786,"In Langchain through 0.0.155, prompt injection allows an attacker to force the service to retrieve data from an arbitrary URL, essentially providing SSRF and potentially injecting content into downstream tasks.",HIGH,LOW,CVSS:3.1/AV:N/AC:L/PR:N/UI:N/S:U/C:H/I:N/A:N,CWE-74,"https://gist.github.com/rharang/d265f46fc3161b31ac2e81db44d662e1, https://gist.github.com/rharang/d265f46fc3161b31ac2e81db44d662e1",External SSRF,Sanitize user input to prevent injection attacks
CVE-2023-5798,"The Assistant WordPress plugin before 1.4.4 does not validate a parameter before making a request to it via wp_remote_get(), which could allow users with a role as low as Editor to perform SSRF attacks",HIGH,LOW,CVSS:3.1/AV:N/AC:L/PR:L/UI:N/S:U/C:H/I:H/A:H,N/A,"https://wpscan.com/vulnerability/bbb4c98c-4dd7-421e-9666-98f15acde761, https://wpscan.com/vulnerability/bbb4c98c-4dd7-421e-9666-98f15acde761",External SSRF,"General SSRF Mitigation: Validate and sanitize all URLs, restrict network access, and enforce security controls."
CVE-2023-46725,"FoodCoopShop is open source software for food coops and local shops. Versions starting with 3.2.0 prior to 3.6.1 are vulnerable to server-side request forgery. In the Network module, a manufacturer account can use the `/api/updateProducts.json` endpoint to make the server send a request to an arbitrary host. This means that the server can be used as a proxy into the internal network where the server is. Furthermore, the checks on a valid image are not adequate, leading to a time of check time of use issue. For example, by using a custom server that returns 200 on HEAD requests, then return a valid image on first GET request and then a 302 redirect to final target on second GET request, the server will copy whatever file is at the redirect destination, making this a full SSRF. Version 3.6.1 fixes this vulnerability.",HIGH,LOW,CVSS:3.1/AV:N/AC:L/PR:L/UI:N/S:U/C:H/I:H/A:N,CWE-918,"https://github.com/foodcoopshop/foodcoopshop/commit/0d5bec5c4c22e1affe7fd321a30e3f3a4d99e808, https://github.com/foodcoopshop/foodcoopshop/pull/972, https://github.com/foodcoopshop/foodcoopshop/security/advisories/GHSA-jhww-fx2j-3rf7, https://pastebin.com/8K5Brwbq, https://github.com/foodcoopshop/foodcoopshop/commit/0d5bec5c4c22e1affe7fd321a30e3f3a4d99e808, https://github.com/foodcoopshop/foodcoopshop/pull/972, https://github.com/foodcoopshop/foodcoopshop/security/advisories/GHSA-jhww-fx2j-3rf7, https://pastebin.com/8K5Brwbq",Internal SSRF,"Restrict internal network access, validate user input, use allowlists for URLs"
CVE-2023-4769,"A SSRF vulnerability has been found in ManageEngine Desktop Central affecting version 9.1.0, specifically the /smtpConfig.do component. This vulnerability could allow an authenticated attacker to launch targeted attacks, such as a cross-port attack, service enumeration and other attacks via HTTP requests.",MEDIUM,HIGH,CVSS:3.1/AV:N/AC:H/PR:H/UI:N/S:U/C:H/I:H/A:H,CWE-918,"https://www.incibe.es/en/incibe-cert/notices/aviso/multiple-vulnerabilities-manageengine-desktop-central, https://www.incibe.es/en/incibe-cert/notices/aviso/multiple-vulnerabilities-manageengine-desktop-central",External SSRF,"Restrict internal network access, validate user input, use allowlists for URLs"
CVE-2023-6199,"Book Stack version 23.10.2 allows filtering local files on the server. This is possible because the application is vulnerable to SSRF.
",HIGH,LOW,CVSS:3.1/AV:N/AC:L/PR:L/UI:N/S:U/C:H/I:L/A:N,CWE-918,"https://fluidattacks.com/advisories/imagination/, https://www.bookstackapp.com/blog/bookstack-release-v23-10-3/, https://fluidattacks.com/advisories/imagination/, https://www.bookstackapp.com/blog/bookstack-release-v23-10-3/",External SSRF,"Restrict internal network access, validate user input, use allowlists for URLs"
CVE-2023-48306,"Nextcloud Server provides data storage for Nextcloud, an open source cloud platform. Starting in version 25.0.0 and prior to versions 25.0.11, 26.0.6, and 27.1.0 of Nextcloud Server and starting in version 22.0.0 and prior to versions 22.2.10.16, 23.0.12.11, 24.0.12.7, 25.0.11, 26.0.6, and 27.1.0 of Nextcloud Enterprise Server, the DNS pin middleware was vulnerable to DNS rebinding allowing an attacker to perform SSRF as a final result. Nextcloud Server 25.0.11, 26.0.6, and 27.1.0 and Nextcloud Enterprise Server 22.2.10.16, 23.0.12.11, 24.0.12.7, 25.0.11, 26.0.6, and 27.1.0 contain patches for this issue. No known workarounds are available.",MEDIUM,LOW,CVSS:3.1/AV:N/AC:L/PR:L/UI:N/S:C/C:L/I:N/A:N,CWE-918,"https://github.com/nextcloud/security-advisories/security/advisories/GHSA-8f69-f9jg-4x3v, https://github.com/nextcloud/server/pull/40234, https://hackerone.com/reports/2115212, https://github.com/nextcloud/security-advisories/security/advisories/GHSA-8f69-f9jg-4x3v, https://github.com/nextcloud/server/pull/40234, https://hackerone.com/reports/2115212",DNS Rebinding SSRF,"Restrict internal network access, validate user input, use allowlists for URLs"
CVE-2023-48307,"Nextcloud Mail is the mail app for Nextcloud, a self-hosted productivity platform. Starting in version 1.13.0 and prior to version 2.2.8 and 3.3.0, an attacker can use an unprotected endpoint in the Mail app to perform a SSRF attack. Nextcloud Mail app versions 2.2.8 and 3.3.0 contain a patch for this issue. As a workaround, disable the mail app.",LOW,LOW,CVSS:3.1/AV:N/AC:L/PR:L/UI:R/S:U/C:N/I:N/A:L,CWE-918,"https://github.com/nextcloud/mail/pull/8709, https://github.com/nextcloud/security-advisories/security/advisories/GHSA-4pp4-m8ph-2999, https://hackerone.com/reports/1869714, https://github.com/nextcloud/mail/pull/8709, https://github.com/nextcloud/security-advisories/security/advisories/GHSA-4pp4-m8ph-2999, https://hackerone.com/reports/1869714",Cloud-Based SSRF,"Restrict internal network access, validate user input, use allowlists for URLs"
CVE-2023-48023,"Anyscale Ray 2.6.3 and 2.8.0 allows /log_proxy SSRF. NOTE: the vendor's position is that this report is irrelevant because Ray, as stated in its documentation, is not intended for use outside of a strictly controlled network environment",CRITICAL,LOW,CVSS:3.1/AV:N/AC:L/PR:N/UI:N/S:U/C:H/I:H/A:N,CWE-918,"https://bishopfox.com/blog/ray-versions-2-6-3-2-8-0, https://docs.ray.io/en/latest/ray-security/index.html, https://bishopfox.com/blog/ray-versions-2-6-3-2-8-0, https://docs.ray.io/en/latest/ray-security/index.html",External SSRF,"Restrict internal network access, validate user input, use allowlists for URLs"
CVE-2023-49735,"** UNSUPPORTED WHEN ASSIGNED **

The value set as the DefaultLocaleResolver.LOCALE_KEY attribute on the session was not validated while resolving XML definition files, leading to possible path traversal and eventually SSRF/XXE when passing user-controlled data to this key. Passing user-controlled data to this key may be relatively common, as it was also used like that to set the language in the 'tiles-test' application shipped with Tiles.

This issue affects Apache Tiles from version 2 onwards.

NOTE: This vulnerability only affects products that are no longer supported by the maintainer.

",HIGH,LOW,CVSS:3.1/AV:N/AC:L/PR:N/UI:N/S:U/C:H/I:N/A:N,CWE-22,"https://lists.apache.org/thread/8ktm4vxr6vvc1qsxh6ft8jzmom1zl65p, https://lists.apache.org/thread/8ktm4vxr6vvc1qsxh6ft8jzmom1zl65p",DNS Rebinding SSRF,Prevent path traversal by validating and sanitizing input paths
