CVE ID,Description,Severity,Attack Complexity,Attack Vector,CWE ID,References,Attack Type,Mitigation Strategy
CVE-2021-36043,"Magento Commerce versions 2.4.2 (and earlier), 2.4.2-p1 (and earlier) and 2.3.7 (and earlier) are affected by a blind SSRF vulnerability in the bundled dotmailer extension. An attacker with admin privileges could abuse this to achieve remote code execution should Redis be enabled.",HIGH,HIGH,CVSS:3.1/AV:N/AC:H/PR:H/UI:N/S:C/C:H/I:H/A:H,CWE-918,"https://helpx.adobe.com/security/products/magento/apsb21-64.html, https://helpx.adobe.com/security/products/magento/apsb21-64.html",Blind SSRF,"Restrict internal network access, validate user input, use allowlists for URLs"
CVE-2021-39497,"eyoucms 1.5.4 lacks sanitization of input data, allowing an attacker to inject a url to trigger blind SSRF via the saveRemote() function.",CRITICAL,LOW,CVSS:3.1/AV:N/AC:L/PR:N/UI:N/S:U/C:H/I:H/A:H,CWE-918,"http://hptcybersec.com/ssrf_PoC.jpg, https://github.com/KietNA-HPT/CVE, https://github.com/eyoucms/eyoucms/releases/tag/v1.5.4, http://hptcybersec.com/ssrf_PoC.jpg, https://github.com/KietNA-HPT/CVE, https://github.com/eyoucms/eyoucms/releases/tag/v1.5.4",Blind SSRF,"Restrict internal network access, validate user input, use allowlists for URLs"
CVE-2021-28910,BAB TECHNOLOGIE GmbH eibPort V3 prior version 3.9.1 contains basic SSRF vulnerability. It allow unauthenticated attackers to request to any internal and external server.,HIGH,LOW,CVSS:3.1/AV:N/AC:L/PR:N/UI:N/S:U/C:H/I:N/A:N,CWE-918,"https://psytester.github.io/CVE-2021-28910, https://psytester.github.io/CVE-2021-28910",Internal SSRF,"Restrict internal network access, validate user input, use allowlists for URLs"
CVE-2021-30137,Assyst 10 SP7.5 has authenticated XXE leading to SSRF via XML unmarshalling. The application allows users to send JSON or XML data to the server. It was possible to inject malicious XML data through several access points.,HIGH,HIGH,CVSS:3.1/AV:N/AC:H/PR:L/UI:N/S:C/C:L/I:L/A:H,CWE-611,"https://github.com/post-cyberlabs/CVE-Advisory/blob/main/CVE-2021-30137.pdf, https://github.com/post-cyberlabs/CVE-Advisory/blob/main/CVE-2021-30137.pdf",External SSRF,Disable XML external entity (XXE) processing to prevent SSRF exploitation
CVE-2021-37419,Zoho ManageEngine ADSelfService Plus before 6112 is vulnerable to SSRF.,HIGH,LOW,CVSS:3.1/AV:N/AC:L/PR:N/UI:N/S:U/C:N/I:H/A:N,CWE-918,"https://blog.stmcyber.com/vulns/cve-2021-37419/, https://pitstop.manageengine.com/portal/en/community/topic/adselfservice-plus-6112-hotfix-release, https://www.manageengine.com, https://blog.stmcyber.com/vulns/cve-2021-37419/, https://pitstop.manageengine.com/portal/en/community/topic/adselfservice-plus-6112-hotfix-release, https://www.manageengine.com",External SSRF,"Restrict internal network access, validate user input, use allowlists for URLs"
CVE-2021-21993,The vCenter Server contains an SSRF (Server Side Request Forgery) vulnerability due to improper validation of URLs in vCenter Server Content Library. An authorised user with access to content library may exploit this issue by sending a POST request to vCenter Server leading to information disclosure.,MEDIUM,LOW,CVSS:3.1/AV:N/AC:L/PR:L/UI:N/S:U/C:H/I:N/A:N,CWE-918,"https://www.vmware.com/security/advisories/VMSA-2021-0020.html, https://www.vmware.com/security/advisories/VMSA-2021-0020.html",External SSRF,"Restrict internal network access, validate user input, use allowlists for URLs"
CVE-2021-41586,"In Gradle Enterprise before 2021.1.3, an attacker with the ability to perform SSRF attacks can potentially reset the system user password.",HIGH,LOW,CVSS:3.1/AV:N/AC:L/PR:N/UI:N/S:U/C:N/I:H/A:N,CWE-918,"https://security.gradle.com/advisory/2021-05, https://security.gradle.com/advisory/2021-05",External SSRF,"Restrict internal network access, validate user input, use allowlists for URLs"
CVE-2021-41587,"In Gradle Enterprise before 2021.1.3, an attacker with the ability to perform SSRF attacks can potentially discover credentials for other resources.",HIGH,LOW,CVSS:3.1/AV:N/AC:L/PR:N/UI:N/S:U/C:H/I:N/A:N,CWE-918,"https://security.gradle.com/advisory/2021-04, https://security.gradle.com/advisory/2021-04",External SSRF,"Restrict internal network access, validate user input, use allowlists for URLs"
CVE-2021-41385,The third party intelligence connector in Securonix SNYPR 6.3.1 Build 184295_0302 allows an authenticated user to obtain access to server configuration details via SSRF.,MEDIUM,LOW,CVSS:3.1/AV:N/AC:L/PR:L/UI:N/S:U/C:H/I:N/A:N,CWE-918,"https://documentation.securonix.com/onlinedoc/Content/Product%20Security/Content/Product%20Security/Authenticated%20SSRF%20in%20TPI.htm, https://documentation.securonix.com/onlinedoc/Content/Product%20Security/Content/Product%20Security/Authenticated%20SSRF%20in%20TPI.htm",External SSRF,"Restrict internal network access, validate user input, use allowlists for URLs"
CVE-2021-40103,An issue was discovered in Concrete CMS through 8.5.5. Path Traversal can lead to Arbitrary File Reading and SSRF.,HIGH,LOW,CVSS:3.1/AV:N/AC:L/PR:N/UI:N/S:U/C:H/I:N/A:N,CWE-22,"https://documentation.concretecms.org/developers/introduction/version-history/856-release-notes, https://hackerone.com/reports/1102211, https://documentation.concretecms.org/developers/introduction/version-history/856-release-notes, https://hackerone.com/reports/1102211",External SSRF,Prevent path traversal by validating and sanitizing input paths
CVE-2021-40109,A SSRF issue was discovered in Concrete CMS through 8.5.5. Users can access forbidden files on their local network. A user with permissions to upload files from external sites can upload a URL that redirects to an internal resource of any file type. The redirect is followed and loads the contents of the file from the redirected-to server. Files of disallowed types can be uploaded.,MEDIUM,LOW,CVSS:3.1/AV:N/AC:L/PR:L/UI:N/S:C/C:L/I:L/A:N,CWE-918,"https://documentation.concretecms.org/developers/introduction/version-history/856-release-notes, https://hackerone.com/reports/1102105, https://documentation.concretecms.org/developers/introduction/version-history/856-release-notes, https://hackerone.com/reports/1102105",Internal SSRF,"Restrict internal network access, validate user input, use allowlists for URLs"
CVE-2021-37223,"Nagios Enterprises NagiosXI <= 5.8.4 contains a Server-Side Request Forgery (SSRF) vulnerability in schedulereport.php. Any authenticated user can create scheduled reports containing PDF screenshots of any view in the NagiosXI application. Due to lack of input sanitisation, the target page can be replaced with an SSRF payload to access internal resources or disclose local system files.",MEDIUM,LOW,CVSS:3.1/AV:N/AC:L/PR:L/UI:N/S:U/C:H/I:N/A:N,CWE-918,"http://nagios.com, https://www.nagios.com/downloads/nagios-xi/change-log/, http://nagios.com, https://www.nagios.com/downloads/nagios-xi/change-log/",Internal SSRF,"Restrict internal network access, validate user input, use allowlists for URLs"
CVE-2021-42091,An issue was discovered in Zammad before 4.1.1. SSRF can occur via GitHub or GitLab integration.,CRITICAL,LOW,CVSS:3.1/AV:N/AC:L/PR:N/UI:N/S:U/C:H/I:H/A:N,CWE-918,"https://zammad.com/en/advisories/zaa-2021-08, https://zammad.com/en/advisories/zaa-2021-08",External SSRF,"Restrict internal network access, validate user input, use allowlists for URLs"
CVE-2021-32663,iTop is an open source web based IT Service Management tool. In affected versions an attacker can call the system setup without authentication. Given specific parameters this can lead to SSRF. This issue has been resolved in versions 2.6.5 and 2.7.5 and later,HIGH,HIGH,CVSS:3.1/AV:N/AC:H/PR:N/UI:N/S:C/C:H/I:H/A:N,CWE-918,"https://github.com/Combodo/iTop/commit/43daa2ef088bf928a2386fa19324628c3f19b807, https://github.com/Combodo/iTop/commit/6be9a87c150978752bc68baae1a5c4833ddadfec, https://github.com/Combodo/iTop/security/advisories/GHSA-ghqc-r8f6-q9m9, https://github.com/Combodo/iTop/commit/43daa2ef088bf928a2386fa19324628c3f19b807, https://github.com/Combodo/iTop/commit/6be9a87c150978752bc68baae1a5c4833ddadfec, https://github.com/Combodo/iTop/security/advisories/GHSA-ghqc-r8f6-q9m9",DNS Rebinding SSRF,"Restrict internal network access, validate user input, use allowlists for URLs"
CVE-2021-41792,"An issue was discovered in Hyland org.alfresco:alfresco-content-services through 6.2.2.18 and org.alfresco:alfresco-transform-services through 1.3. A crafted HTML file, once uploaded, could trigger an unexpected request by the transformation engine. The response to the request is not available to the attacker, i.e., this is blind SSRF.",MEDIUM,LOW,CVSS:3.1/AV:N/AC:L/PR:N/UI:N/S:U/C:N/I:L/A:N,CWE-918,"https://github.com/Alfresco/acs-packaging/blob/master/DISCLOSURES.md, https://www.themissinglink.com.au/, https://github.com/Alfresco/acs-packaging/blob/master/DISCLOSURES.md, https://www.themissinglink.com.au/",Blind SSRF,"Restrict internal network access, validate user input, use allowlists for URLs"
CVE-2021-35512,An SSRF issue was discovered in Zoho ManageEngine Applications Manager build 15200.,MEDIUM,LOW,CVSS:3.1/AV:N/AC:L/PR:N/UI:N/S:U/C:L/I:L/A:N,CWE-918,"https://www.esecforte.com/server-side-request-forgery-india-ssrf-rvd-manage-engine/, https://www.manageengine.com/products/applications_manager/, https://www.manageengine.com/products/applications_manager/release-notes.html, https://www.esecforte.com/server-side-request-forgery-india-ssrf-rvd-manage-engine/, https://www.manageengine.com/products/applications_manager/, https://www.manageengine.com/products/applications_manager/release-notes.html",External SSRF,"Restrict internal network access, validate user input, use allowlists for URLs"
CVE-2021-43562,"An issue was discovered in the pixxio (aka pixx.io integration or DAM) extension before 1.0.6 for TYPO3. The extension fails to restrict the image download to the configured pixx.io DAM URL, resulting in SSRF. As a result, an attacker can download various content from a remote location and save it to a user-controlled filename, which may result in Remote Code Execution. A TYPO3 backend user account is required to exploit this.",HIGH,LOW,CVSS:3.1/AV:N/AC:L/PR:L/UI:N/S:U/C:H/I:H/A:H,CWE-918,"https://typo3.org/security/advisory/typo3-ext-sa-2021-017, https://typo3.org/security/advisory/typo3-ext-sa-2021-017",External SSRF,"Restrict internal network access, validate user input, use allowlists for URLs"
CVE-2021-39303,"The server in Jamf Pro before 10.32.0 has an SSRF vulnerability, aka PI-006352. NOTE: Jamf Nation will also publish an article about this vulnerability.",CRITICAL,LOW,CVSS:3.1/AV:N/AC:L/PR:N/UI:N/S:U/C:H/I:H/A:H,CWE-918,"https://blog.assetnote.io/2021/11/30/jamf-ssrf/, https://community.jamf.com/t5/jamf-pro/what-s-new-in-jamf-pro-10-32-release/m-p/246505, https://docs.jamf.com/10.32.0/jamf-pro/release-notes/Resolved_Issues.html, https://www.jamf.com/resources/product-documentation/jamf-pro-release-notes/, https://blog.assetnote.io/2021/11/30/jamf-ssrf/, https://community.jamf.com/t5/jamf-pro/what-s-new-in-jamf-pro-10-32-release/m-p/246505, https://docs.jamf.com/10.32.0/jamf-pro/release-notes/Resolved_Issues.html, https://www.jamf.com/resources/product-documentation/jamf-pro-release-notes/",External SSRF,"Restrict internal network access, validate user input, use allowlists for URLs"
CVE-2021-22969,Concrete CMS (formerly concrete5) versions below 8.5.7 has a SSRF mitigation bypass using DNS Rebind attack giving an attacker the ability to fetch cloud IAAS (ex AWS) IAM keys.To fix this Concrete CMS no longer allows downloads from the local network and specifies the validated IP when downloading rather than relying on DNS.Discoverer: Adrian Tiron from FORTBRIDGE ( https://www.fortbridge.co.uk/ )The Concrete CMS team gave this a CVSS 3.1 score of 3.5 AV:N/AC:H/PR:L/UI:N/S:C/C:L/I:N/A:N . Please note that Cloud IAAS provider mis-configurations are not Concrete CMS vulnerabilities. A mitigation for this vulnerability is to make sure that the IMDS configurations are according to a cloud provider's best practices.This fix is also in Concrete version 9.0.0,MEDIUM,LOW,CVSS:3.1/AV:N/AC:L/PR:N/UI:N/S:U/C:L/I:N/A:N,CWE-918,"https://documentation.concretecms.org/developers/introduction/version-history/857-release-notes, https://hackerone.com/reports/1369312, https://documentation.concretecms.org/developers/introduction/version-history/857-release-notes, https://hackerone.com/reports/1369312",DNS Rebinding SSRF,"Restrict internal network access, validate user input, use allowlists for URLs"
CVE-2021-22970,Concrete CMS (formerly concrete5) versions 8.5.6 and below and version 9.0.0 allow local IP importing causing the system to be vulnerable toa. SSRF attacks on the private LAN servers by reading files from the local LAN. An attacker can pivot in the private LAN and exploit local network appsandb. SSRF Mitigation Bypass through DNS RebindingConcrete CMS security team gave this a CVSS score of 3.5 AV:N/AC:H/PR:L/UI:N/S:C/C:L/I:N/A:NConcrete CMS is maintaining Concrete version 8.5.x until 1 May 2022 for security fixes.This CVE is shared with HackerOne Reports https://hackerone.com/reports/1364797 and https://hackerone.com/reports/1360016Reporters: Adrian Tiron from FORTBRIDGE (https://www.fortbridge.co.uk/ ) and Bipul Jaiswal,HIGH,LOW,CVSS:3.1/AV:N/AC:L/PR:N/UI:N/S:U/C:H/I:N/A:N,CWE-918,"https://documentation.concretecms.org/developers/introduction/version-history/857-release-notes, https://documentation.concretecms.org/developers/introduction/version-history/901-release-notes, https://hackerone.com/reports/1364797, https://documentation.concretecms.org/developers/introduction/version-history/857-release-notes, https://documentation.concretecms.org/developers/introduction/version-history/901-release-notes, https://hackerone.com/reports/1364797",DNS Rebinding SSRF,"Restrict internal network access, validate user input, use allowlists for URLs"
CVE-2021-23718,The package ssrf-agent before 1.0.5 are vulnerable to Server-side Request Forgery (SSRF) via the defaultIpChecker function. It fails to properly validate if the IP requested is private.,MEDIUM,LOW,CVSS:3.1/AV:N/AC:L/PR:N/UI:R/S:U/C:H/I:N/A:N,CWE-918,"https://github.com/welefen/ssrf-agent/blob/cec2b85fe8886ad6926a247a3e059d8369ec022b/index.js%23L13, https://security.netapp.com/advisory/ntap-20211203-0005/, https://snyk.io/vuln/SNYK-JS-SSRFAGENT-1584362, https://github.com/welefen/ssrf-agent/blob/cec2b85fe8886ad6926a247a3e059d8369ec022b/index.js%23L13, https://security.netapp.com/advisory/ntap-20211203-0005/, https://snyk.io/vuln/SNYK-JS-SSRFAGENT-1584362",External SSRF,"Restrict internal network access, validate user input, use allowlists for URLs"
CVE-2021-22049,The vSphere Web Client (FLEX/Flash) contains an SSRF (Server Side Request Forgery) vulnerability in the vSAN Web Client (vSAN UI) plug-in. A malicious actor with network access to port 443 on vCenter Server may exploit this issue by accessing a URL request outside of vCenter Server or accessing an internal service.,CRITICAL,LOW,CVSS:3.1/AV:N/AC:L/PR:N/UI:N/S:U/C:H/I:H/A:H,CWE-918,"https://www.vmware.com/security/advisories/VMSA-2021-0027.html, https://www.vmware.com/security/advisories/VMSA-2021-0027.html",Internal SSRF,"Restrict internal network access, validate user input, use allowlists for URLs"
CVE-2021-43296,Zoho ManageEngine SupportCenter Plus before 11016 is vulnerable to an SSRF attack in ActionExecutor.,HIGH,LOW,CVSS:3.1/AV:N/AC:L/PR:N/UI:N/S:U/C:H/I:N/A:N,CWE-918,"https://manageengine.com, https://www.manageengine.com/products/support-center/readme.html#11016, https://manageengine.com, https://www.manageengine.com/products/support-center/readme.html#11016",External SSRF,"Restrict internal network access, validate user input, use allowlists for URLs"
CVE-2021-40091,An SSRF issue was discovered in SquaredUp for SCOM 5.2.1.6654.,CRITICAL,LOW,CVSS:3.1/AV:N/AC:L/PR:N/UI:N/S:U/C:H/I:H/A:H,CWE-918,"https://support.squaredup.com, https://support.squaredup.com/hc/en-us/articles/4410656394129-CVE-2021-40091-SSRF-issue, https://support.squaredup.com, https://support.squaredup.com/hc/en-us/articles/4410656394129-CVE-2021-40091-SSRF-issue",External SSRF,"Restrict internal network access, validate user input, use allowlists for URLs"
CVE-2021-22054,"VMware Workspace ONE UEM console 20.0.8 prior to 20.0.8.37, 20.11.0 prior to 20.11.0.40, 21.2.0 prior to 21.2.0.27, and 21.5.0 prior to 21.5.0.37 contain an SSRF vulnerability. This issue may allow a malicious actor with network access to UEM to send their requests without authentication and to gain access to sensitive information.",HIGH,LOW,CVSS:3.1/AV:N/AC:L/PR:N/UI:N/S:U/C:H/I:N/A:N,CWE-918,"https://www.vmware.com/security/advisories/VMSA-2021-0029.html, https://www.vmware.com/security/advisories/VMSA-2021-0029.html",External SSRF,"Restrict internal network access, validate user input, use allowlists for URLs"
CVE-2021-22056,"VMware Workspace ONE Access 21.08, 20.10.0.1, and 20.10 and Identity Manager 3.3.5, 3.3.4, and 3.3.3 contain an SSRF vulnerability. A malicious actor with network access may be able to make HTTP requests to arbitrary origins and read the full response.",HIGH,LOW,CVSS:3.1/AV:N/AC:L/PR:N/UI:N/S:U/C:H/I:N/A:N,CWE-918,"https://www.vmware.com/security/advisories/VMSA-2021-0030.html, https://www.vmware.com/security/advisories/VMSA-2021-0030.html",External SSRF,"Restrict internal network access, validate user input, use allowlists for URLs"
CVE-2022-22702,"PartKeepr versions up to v1.4.0, in the functionality to upload attachments using a URL when creating a part does not validate that requests can be made to local ports, allowing an authenticated user to carry out SSRF attacks and port enumeration.",MEDIUM,LOW,CVSS:3.1/AV:N/AC:L/PR:L/UI:N/S:U/C:L/I:N/A:N,CWE-918,"https://fluidattacks.com/advisories/joplin/, https://github.com/partkeepr/PartKeepr/issues/1230, https://fluidattacks.com/advisories/joplin/, https://github.com/partkeepr/PartKeepr/issues/1230",External SSRF,"Restrict internal network access, validate user input, use allowlists for URLs"
CVE-2021-41809,"SSRF vulnerability in M-Files Server products with versions before 22.1.11017.1, in a preview function allowed making queries from the server with certain document types referencing external entities.",LOW,LOW,CVSS:3.1/AV:N/AC:L/PR:L/UI:R/S:U/C:L/I:N/A:N,CWE-918,"https://www.m-files.com/about/trust-center/security-vulnerabilities/cve-2021-41809/, https://www.m-files.com/about/trust-center/security-vulnerabilities/cve-2021-41809/",External SSRF,"Restrict internal network access, validate user input, use allowlists for URLs"
CVE-2022-22993,A limited SSRF vulnerability was discovered on Western Digital My Cloud devices that could allow an attacker to impersonate a server and reach any page on the server by bypassing access controls. The vulnerability was addressed by creating a whitelist for valid parameters.,HIGH,HIGH,CVSS:3.1/AV:L/AC:H/PR:N/UI:N/S:C/C:H/I:H/A:N,CWE-918,"https://www.westerndigital.com/support/product-security/wdc-22002-my-cloud-os5-firmware-5-19-117, https://www.zerodayinitiative.com/advisories/ZDI-22-348/, https://www.westerndigital.com/support/product-security/wdc-22002-my-cloud-os5-firmware-5-19-117, https://www.zerodayinitiative.com/advisories/ZDI-22-348/",Cloud-Based SSRF,"Restrict internal network access, validate user input, use allowlists for URLs"
CVE-2021-25939,"In ArangoDB, versions v3.7.0 through v3.9.0-alpha.1 have a feature which allows downloading a Foxx service from a publicly available URL. This feature does not enforce proper filtering of requests performed internally, which can be abused by a highly-privileged attacker to perform blind SSRF and send internal requests to localhost.",LOW,LOW,CVSS:3.1/AV:N/AC:L/PR:H/UI:N/S:U/C:N/I:L/A:N,CWE-918,"https://github.com/arangodb/arangodb/commit/d7b35a6884c6b2802d34d79fb2a79fb2c9ec2175, https://github.com/arangodb/arangodb/commit/d9b7f019d2435f107b19a59190bf9cc27d5f34dd, https://www.whitesourcesoftware.com/vulnerability-database/CVE-2021-25939, https://github.com/arangodb/arangodb/commit/d7b35a6884c6b2802d34d79fb2a79fb2c9ec2175, https://github.com/arangodb/arangodb/commit/d9b7f019d2435f107b19a59190bf9cc27d5f34dd, https://www.whitesourcesoftware.com/vulnerability-database/CVE-2021-25939",Internal SSRF,"Restrict internal network access, validate user input, use allowlists for URLs"
CVE-2022-0671,A flaw was found in vscode-xml in versions prior to 0.19.0. Schema download could lead to blind SSRF or DoS via a large file.,CRITICAL,LOW,CVSS:3.1/AV:N/AC:L/PR:N/UI:N/S:U/C:H/I:N/A:H,CWE-918,"https://github.com/eclipse/lemminx/blob/master/CHANGELOG.md#0190-february-14-2022, https://github.com/redhat-developer/vscode-xml/blob/master/CHANGELOG.md#0190-february-14-2022, https://github.com/eclipse/lemminx/blob/master/CHANGELOG.md#0190-february-14-2022, https://github.com/redhat-developer/vscode-xml/blob/master/CHANGELOG.md#0190-february-14-2022",Blind SSRF,"Restrict internal network access, validate user input, use allowlists for URLs"
CVE-2022-24980,"An issue was discovered in the Kitodo.Presentation (aka dif) extension before 2.3.2, 3.x before 3.2.3, and 3.3.x before 3.3.4 for TYPO3. A missing access check in an eID script allows an unauthenticated user to submit arbitrary URLs to this component. This results in SSRF, allowing attackers to view the content of any file or webpage the webserver has access to.",HIGH,LOW,CVSS:3.1/AV:N/AC:L/PR:N/UI:N/S:U/C:H/I:N/A:N,CWE-918,"https://typo3.org/help/security-advisories, https://typo3.org/security/advisory/typo3-ext-sa-2022-001, https://typo3.org/help/security-advisories, https://typo3.org/security/advisory/typo3-ext-sa-2022-001",External SSRF,"Restrict internal network access, validate user input, use allowlists for URLs"
CVE-2022-24333,"In JetBrains TeamCity before 2021.2, blind SSRF via an XML-RPC call was possible.",MEDIUM,LOW,CVSS:3.1/AV:N/AC:L/PR:L/UI:N/S:U/C:H/I:N/A:N,CWE-918,"https://blog.jetbrains.com, https://blog.jetbrains.com/blog/2022/02/08/jetbrains-security-bulletin-q4-2021/, https://blog.jetbrains.com, https://blog.jetbrains.com/blog/2022/02/08/jetbrains-security-bulletin-q4-2021/",Blind SSRF,"Restrict internal network access, validate user input, use allowlists for URLs"
CVE-2022-24739,"alltube is an html front end for youtube-dl. On releases prior to 3.0.3, an attacker could craft a special HTML page to trigger either an open redirect attack or a Server-Side Request Forgery attack (depending on how AllTube is configured). The impact is mitigated by the fact the SSRF attack is only possible when the `stream` option is enabled in the configuration. (This option is disabled by default.) 3.0.3 contains a fix for this vulnerability.",HIGH,LOW,CVSS:3.1/AV:N/AC:L/PR:N/UI:N/S:U/C:L/I:L/A:L,CWE-601,"https://github.com/Rudloff/alltube/commit/3a4f09dda0a466662a4e52cde674749e0c668e8d, https://github.com/Rudloff/alltube/commit/8913f27716400dabf4906a5ad690a5238f73496a, https://github.com/Rudloff/alltube/commit/bc14b6e45c766c05757fb607ef8d444cbbfba71a, https://github.com/Rudloff/alltube/security/advisories/GHSA-75p7-527p-w8wp, https://github.com/Rudloff/alltube/commit/3a4f09dda0a466662a4e52cde674749e0c668e8d, https://github.com/Rudloff/alltube/commit/8913f27716400dabf4906a5ad690a5238f73496a, https://github.com/Rudloff/alltube/commit/bc14b6e45c766c05757fb607ef8d444cbbfba71a, https://github.com/Rudloff/alltube/security/advisories/GHSA-75p7-527p-w8wp",External SSRF,"Prevent open redirects to untrusted domains, implement URL allowlists"
CVE-2021-45968,"An issue was discovered in xmppserver jar in the XMPP Server component of the JIve platform, as used in Pascom Cloud Phone System before 7.20.x (and in other products). An endpoint in the backend Tomcat server of the Pascom allows SSRF, a related issue to CVE-2019-18394.",HIGH,LOW,CVSS:3.1/AV:N/AC:L/PR:N/UI:N/S:U/C:H/I:N/A:N,CWE-918,"https://jivesoftware.com/platform/, https://kerbit.io/research/read/blog/4, https://tutorialboy24.blogspot.com/2022/03/the-story-of-3-bugs-that-lead-to.html, https://www.pascom.net/doc/en/release-notes/, https://www.pascom.net/doc/en/release-notes/pascom19/, https://jivesoftware.com/platform/, https://kerbit.io/research/read/blog/4, https://tutorialboy24.blogspot.com/2022/03/the-story-of-3-bugs-that-lead-to.html, https://www.pascom.net/doc/en/release-notes/, https://www.pascom.net/doc/en/release-notes/pascom19/",Cloud-Based SSRF,"Restrict internal network access, validate user input, use allowlists for URLs"
CVE-2022-27245,An issue was discovered in MISP before 2.4.156. app/Model/Server.php does not restrict generateServerSettings to the CLI. This could lead to SSRF.,HIGH,LOW,CVSS:3.1/AV:N/AC:L/PR:N/UI:R/S:U/C:H/I:H/A:H,CWE-918,"https://github.com/MISP/MISP/commit/8dcf414340c5ddedfebbc972601646d38e1d0717, https://github.com/MISP/MISP/commit/8dcf414340c5ddedfebbc972601646d38e1d0717",External SSRF,"Restrict internal network access, validate user input, use allowlists for URLs"
CVE-2022-0591,"The FormCraft WordPress plugin before 3.8.28 does not validate the URL parameter in the formcraft3_get AJAX action, leading to SSRF issues exploitable by unauthenticated users",CRITICAL,LOW,CVSS:3.1/AV:N/AC:L/PR:N/UI:N/S:U/C:H/I:H/A:N,CWE-918,"https://wpscan.com/vulnerability/b5303e63-d640-4178-9237-d0f524b13d47, https://wpscan.com/vulnerability/b5303e63-d640-4178-9237-d0f524b13d47",External SSRF,"Restrict internal network access, validate user input, use allowlists for URLs"
