CVE ID,Description,Severity,Attack Complexity,Attack Vector,CWE ID,References,Attack Type,Mitigation Strategy
CVE-2020-11453,"Microstrategy Web 10.4 is vulnerable to Server-Side Request Forgery in the Test Web Service functionality exposed through the path /MicroStrategyWS/. The functionality requires no authentication and, while it is not possible to pass parameters in the SSRF request, it is still possible to exploit it to conduct port scanning. An attacker could exploit this vulnerability to enumerate the resources allocated in the network (IP addresses and services exposed). NOTE: MicroStrategy is unable to reproduce the issue reported in any version of its product",MEDIUM,LOW,CVSS:3.1/AV:N/AC:L/PR:N/UI:N/S:U/C:L/I:N/A:N,CWE-918,"http://packetstormsecurity.com/files/157068/MicroStrategy-Intelligence-Server-And-Web-10.4-XSS-Disclosure-SSRF-Code-Execution.html, http://seclists.org/fulldisclosure/2020/Apr/1, https://community.microstrategy.com/s/article/Web-Services-Security-Vulnerability, https://www.redtimmy.com/web-application-hacking/another-ssrf-another-rce-the-microstrategy-case/, http://packetstormsecurity.com/files/157068/MicroStrategy-Intelligence-Server-And-Web-10.4-XSS-Disclosure-SSRF-Code-Execution.html, http://seclists.org/fulldisclosure/2020/Apr/1, https://community.microstrategy.com/s/article/Web-Services-Security-Vulnerability, https://www.redtimmy.com/web-application-hacking/another-ssrf-another-rce-the-microstrategy-case/",External SSRF,"Restrict internal network access, validate user input, use allowlists for URLs"
CVE-2020-10980,GitLab EE/CE 8.0.rc1 to 12.9 is vulnerable to a blind SSRF in the FogBugz integration.,CRITICAL,LOW,CVSS:3.1/AV:N/AC:L/PR:N/UI:N/S:U/C:H/I:H/A:H,CWE-918,"https://about.gitlab.com/releases/2020/03/26/security-release-12-dot-9-dot-1-released/, https://about.gitlab.com/releases/categories/releases/, https://about.gitlab.com/releases/2020/03/26/security-release-12-dot-9-dot-1-released/, https://about.gitlab.com/releases/categories/releases/",Blind SSRF,"Restrict internal network access, validate user input, use allowlists for URLs"
CVE-2020-11885,WSO2 Enterprise Integrator through 6.6.0 has an XXE vulnerability where a user (with admin console access) can use the XML validator to make unintended network invocations such as SSRF via an uploaded file.,HIGH,LOW,CVSS:3.1/AV:N/AC:L/PR:H/UI:N/S:U/C:H/I:H/A:H,CWE-611,"https://docs.wso2.com/display/Security/Security+Advisory+WSO2-2020-0684, https://docs.wso2.com/display/Security/Security+Advisory+WSO2-2020-0684",External SSRF,Disable XML external entity (XXE) processing to prevent SSRF exploitation
CVE-2020-11887,svg2png 4.1.1 allows XSS with resultant SSRF via JavaScript inside an SVG document.,MEDIUM,LOW,CVSS:3.1/AV:N/AC:L/PR:N/UI:R/S:C/C:L/I:L/A:N,CWE-79,"https://github.com/domenic/svg2png/issues/117, https://github.com/domenic/svg2png/issues/117",External SSRF,Implement strict cross-site scripting (XSS) prevention mechanisms
CVE-2020-12642,"An issue was discovered in service-api before 4.3.12 and 5.x before 5.1.1 for Report Portal. It allows XXE, with resultant secrets disclosure and SSRF, via JUnit XML launch import.",HIGH,LOW,CVSS:3.1/AV:N/AC:L/PR:N/UI:N/S:U/C:H/I:N/A:N,CWE-611,"https://github.com/reportportal/reportportal/blob/master/SECURITY_ADVISORIES.md, https://github.com/reportportal/reportportal/blob/master/SECURITY_ADVISORIES.md",External SSRF,Disable XML external entity (XXE) processing to prevent SSRF exploitation
CVE-2020-7983,A CSRF issue in login.asp on Ruckus R500 3.4.2.0.384 devices allows remote attackers to access the panel or conduct SSRF attacks.,HIGH,LOW,CVSS:3.1/AV:N/AC:L/PR:N/UI:R/S:U/C:H/I:H/A:N,CWE-352,"https://gist.github.com/CyberSecurityUP/26c5b032897630fe8407da4a8ef216d4, https://gist.github.com/CyberSecurityUP/26c5b032897630fe8407da4a8ef216d4",External SSRF,"Implement CSRF protection, enforce SameSite cookies, and use CSRF tokens"
CVE-2020-8830,"CSRF in login.asp on Ruckus devices allows an attacker to access the panel, and use SSRF to perform scraping or other analysis via the SUBCA-1 field on the Wireless Admin screen.",HIGH,LOW,CVSS:3.1/AV:N/AC:L/PR:N/UI:R/S:U/C:H/I:H/A:H,CWE-352,"https://gist.github.com/CyberSecurityUP/26c5b032897630fe8407da4a8ef216d4, https://gist.github.com/CyberSecurityUP/26c5b032897630fe8407da4a8ef216d4",External SSRF,"Implement CSRF protection, enforce SameSite cookies, and use CSRF tokens"
CVE-2020-13226,"WSO2 API Manager 3.0.0 does not properly restrict outbound network access from a Publisher node, opening up the possibility of SSRF to this node's entire intranet.",CRITICAL,LOW,CVSS:3.1/AV:N/AC:L/PR:N/UI:N/S:U/C:H/I:H/A:H,CWE-918,"https://docs.wso2.com/display/Security/Security+Advisories, https://docs.wso2.com/display/Security/WSO2+Security+Vulnerability+Management+Process, https://github.com/wso2/docs-apim/issues/816, https://github.com/wso2/product-apim/issues/7677, https://docs.wso2.com/display/Security/Security+Advisories, https://docs.wso2.com/display/Security/WSO2+Security+Vulnerability+Management+Process, https://github.com/wso2/docs-apim/issues/816, https://github.com/wso2/product-apim/issues/7677",External SSRF,"Restrict internal network access, validate user input, use allowlists for URLs"
CVE-2014-8943,Lexiglot through 2014-11-20 allows SSRF via the admin.php?page=projects svn_url parameter.,HIGH,LOW,CVSS:3.1/AV:N/AC:L/PR:L/UI:N/S:U/C:H/I:H/A:H,CWE-918,"https://www.justanotherhacker.com/2018/05/jahx181_-_piwigo_lexiglot_multiple_vulnerabilities.html, https://www.justanotherhacker.com/2018/05/jahx181_-_piwigo_lexiglot_multiple_vulnerabilities.html",External SSRF,"Restrict internal network access, validate user input, use allowlists for URLs"
CVE-2020-13379,"The avatar feature in Grafana 3.0.1 through 7.0.1 has an SSRF Incorrect Access Control issue. This vulnerability allows any unauthenticated user/client to make Grafana send HTTP requests to any URL and return its result to the user/client. This can be used to gain information about the network that Grafana is running on. Furthermore, passing invalid URL objects could be used for DOS'ing Grafana via SegFault.",HIGH,LOW,CVSS:3.1/AV:N/AC:L/PR:N/UI:N/S:U/C:L/I:N/A:H,CWE-918,"http://lists.opensuse.org/opensuse-security-announce/2020-06/msg00060.html, http://lists.opensuse.org/opensuse-security-announce/2020-07/msg00083.html, http://lists.opensuse.org/opensuse-security-announce/2020-10/msg00009.html, http://lists.opensuse.org/opensuse-security-announce/2020-10/msg00017.html, http://packetstormsecurity.com/files/158320/Grafana-7.0.1-Denial-Of-Service.html, http://www.openwall.com/lists/oss-security/2020/06/03/4, http://www.openwall.com/lists/oss-security/2020/06/09/2, https://community.grafana.com/t/grafana-7-0-2-and-6-7-4-security-update/31408, https://community.grafana.com/t/release-notes-v6-7-x/27119, https://community.grafana.com/t/release-notes-v7-0-x/29381, https://grafana.com/blog/2020/06/03/grafana-6.7.4-and-7.0.2-released-with-important-security-fix/, https://lists.apache.org/thread.html/r0928ee574281f8b6156e0a6d0291bfc27100a9dd3f9b0177ece24ae4%40%3Cdev.ambari.apache.org%3E, https://lists.apache.org/thread.html/r093b405a49fd31efa0d949ac1a887101af1ca95652a66094194ed933%40%3Cdev.ambari.apache.org%3E, https://lists.apache.org/thread.html/r40f0a97b6765de6b8938bc212ee9dfb5101e9efa48bcbbdec02b2a60%40%3Cissues.ambari.apache.org%3E, https://lists.apache.org/thread.html/r6670a6c29044bcb77d4e5d165b5bd13fffe37b84caa5d6471b13b3a2%40%3Cdev.ambari.apache.org%3E, https://lists.apache.org/thread.html/r6bb57124a21bb638f552d81650c66684e70fc1ff9f40b6a8840171cd%40%3Cissues.ambari.apache.org%3E, https://lists.apache.org/thread.html/r984c3b42a500f5a6a89fbee436b9432fada5dc27ebab04910aafe4da%40%3Cissues.ambari.apache.org%3E, https://lists.apache.org/thread.html/rad99b06d7360a5cf6e394afb313f8901dcd4cb777aee9c9197b3b23d%40%3Cdev.ambari.apache.org%3E, https://lists.apache.org/thread.html/rba0247a27be78bd14046724098462d058a9969400a82344b3007cf90%40%3Cdev.ambari.apache.org%3E, https://lists.apache.org/thread.html/rd0fd283e3844b9c54cd5ecc92d966f96d3f4318815bbf3ac41f9c820%40%3Ccommits.ambari.apache.org%3E, https://lists.apache.org/thread.html/re75f59639f3bc1d14c7ab362bc4485ade84f3c6a3c1a03200c20fe13%40%3Cissues.ambari.apache.org%3E, https://lists.apache.org/thread.html/re7c4b251b52f49ba6ef752b829bca9565faaf93d03206b1db6644d31%40%3Cdev.ambari.apache.org%3E, https://lists.apache.org/thread.html/rff71126fa7d9f572baafb9be44078ad409c85d2c0f3e26664f1ef5a2%40%3Cdev.ambari.apache.org%3E, https://lists.fedoraproject.org/archives/list/package-announce%40lists.fedoraproject.org/message/EEKSZ6GE4EDOFZ23NGYWOCMD6O4JF5SO/, https://lists.fedoraproject.org/archives/list/package-announce%40lists.fedoraproject.org/message/O2KSCCGKNEENZN3DW7TSPFBBUZH3YZXZ/, https://mostwanted002.cf/post/grafanados/, https://rhynorater.github.io/CVE-2020-13379-Write-Up, https://security.netapp.com/advisory/ntap-20200608-0006/, http://lists.opensuse.org/opensuse-security-announce/2020-06/msg00060.html, http://lists.opensuse.org/opensuse-security-announce/2020-07/msg00083.html, http://lists.opensuse.org/opensuse-security-announce/2020-10/msg00009.html, http://lists.opensuse.org/opensuse-security-announce/2020-10/msg00017.html, http://packetstormsecurity.com/files/158320/Grafana-7.0.1-Denial-Of-Service.html, http://www.openwall.com/lists/oss-security/2020/06/03/4, http://www.openwall.com/lists/oss-security/2020/06/09/2, https://community.grafana.com/t/grafana-7-0-2-and-6-7-4-security-update/31408, https://community.grafana.com/t/release-notes-v6-7-x/27119, https://community.grafana.com/t/release-notes-v7-0-x/29381, https://grafana.com/blog/2020/06/03/grafana-6.7.4-and-7.0.2-released-with-important-security-fix/, https://lists.apache.org/thread.html/r0928ee574281f8b6156e0a6d0291bfc27100a9dd3f9b0177ece24ae4%40%3Cdev.ambari.apache.org%3E, https://lists.apache.org/thread.html/r093b405a49fd31efa0d949ac1a887101af1ca95652a66094194ed933%40%3Cdev.ambari.apache.org%3E, https://lists.apache.org/thread.html/r40f0a97b6765de6b8938bc212ee9dfb5101e9efa48bcbbdec02b2a60%40%3Cissues.ambari.apache.org%3E, https://lists.apache.org/thread.html/r6670a6c29044bcb77d4e5d165b5bd13fffe37b84caa5d6471b13b3a2%40%3Cdev.ambari.apache.org%3E, https://lists.apache.org/thread.html/r6bb57124a21bb638f552d81650c66684e70fc1ff9f40b6a8840171cd%40%3Cissues.ambari.apache.org%3E, https://lists.apache.org/thread.html/r984c3b42a500f5a6a89fbee436b9432fada5dc27ebab04910aafe4da%40%3Cissues.ambari.apache.org%3E, https://lists.apache.org/thread.html/rad99b06d7360a5cf6e394afb313f8901dcd4cb777aee9c9197b3b23d%40%3Cdev.ambari.apache.org%3E, https://lists.apache.org/thread.html/rba0247a27be78bd14046724098462d058a9969400a82344b3007cf90%40%3Cdev.ambari.apache.org%3E, https://lists.apache.org/thread.html/rd0fd283e3844b9c54cd5ecc92d966f96d3f4318815bbf3ac41f9c820%40%3Ccommits.ambari.apache.org%3E, https://lists.apache.org/thread.html/re75f59639f3bc1d14c7ab362bc4485ade84f3c6a3c1a03200c20fe13%40%3Cissues.ambari.apache.org%3E, https://lists.apache.org/thread.html/re7c4b251b52f49ba6ef752b829bca9565faaf93d03206b1db6644d31%40%3Cdev.ambari.apache.org%3E, https://lists.apache.org/thread.html/rff71126fa7d9f572baafb9be44078ad409c85d2c0f3e26664f1ef5a2%40%3Cdev.ambari.apache.org%3E, https://lists.fedoraproject.org/archives/list/package-announce%40lists.fedoraproject.org/message/EEKSZ6GE4EDOFZ23NGYWOCMD6O4JF5SO/, https://lists.fedoraproject.org/archives/list/package-announce%40lists.fedoraproject.org/message/O2KSCCGKNEENZN3DW7TSPFBBUZH3YZXZ/, https://mostwanted002.cf/post/grafanados/, https://rhynorater.github.io/CVE-2020-13379-Write-Up, https://security.netapp.com/advisory/ntap-20200608-0006/",External SSRF,"Restrict internal network access, validate user input, use allowlists for URLs"
CVE-2020-12725,"Havoc Research discovered an authenticated Server-Side Request Forgery (SSRF) via the ""JSON"" data source of Redash open-source 8.0.0 and prior. Possibly, other connectors are affected. The SSRF is potent and provides a lot of flexibility in terms of being able to craft HTTP requests e.g., by adding headers, selecting any HTTP verb, etc.",HIGH,LOW,CVSS:3.1/AV:N/AC:L/PR:H/UI:N/S:U/C:H/I:H/A:H,CWE-918,"https://blog.redash.io, https://github.com/getredash/redash/commits/master, https://github.com/getredash/redash/issues/4869, https://blog.redash.io, https://github.com/getredash/redash/commits/master, https://github.com/getredash/redash/issues/4869",External SSRF,"Restrict internal network access, validate user input, use allowlists for URLs"
CVE-2020-11980,"In Karaf, JMX authentication takes place using JAAS and authorization takes place using ACL files. By default, only an ""admin"" can actually invoke on an MBean. However there is a vulnerability there for someone who is not an admin, but has a ""viewer"" role. In the 'etc/jmx.acl.cfg', such as role can call get*. It's possible to authenticate as a viewer role + invokes on the MLet getMBeansFromURL method, which goes off to a remote server to fetch the desired MBean, which is then registered in Karaf. At this point the attack fails as ""viewer"" doesn't have the permission to invoke on the MBean. Still, it could act as a SSRF style attack and also it essentially allows a ""viewer"" role to pollute the MBean registry, which is a kind of privilege escalation. The vulnerability is low as it's possible to add a ACL to limit access. Users should update to Apache Karaf 4.2.9 or newer.",MEDIUM,LOW,CVSS:3.1/AV:N/AC:L/PR:L/UI:N/S:U/C:L/I:L/A:L,CWE-918,"http://karaf.apache.org/security/cve-2020-11980.txt, http://karaf.apache.org/security/cve-2020-11980.txt",External SSRF,"Restrict internal network access, validate user input, use allowlists for URLs"
CVE-2020-9427,OX Guard 2.10.3 and earlier allows SSRF.,MEDIUM,LOW,CVSS:3.1/AV:N/AC:L/PR:L/UI:N/S:C/C:L/I:N/A:N,CWE-918,"http://packetstormsecurity.com/files/158069/OX-Guard-2.10.3-Cross-Site-Scripting-Server-Side-Request-Forgery.html, https://seclists.org/fulldisclosure/2020/Jun/20, https://www.open-xchange.com/, http://packetstormsecurity.com/files/158069/OX-Guard-2.10.3-Cross-Site-Scripting-Server-Side-Request-Forgery.html, https://seclists.org/fulldisclosure/2020/Jun/20, https://www.open-xchange.com/",External SSRF,"Restrict internal network access, validate user input, use allowlists for URLs"
CVE-2020-8544,OX App Suite through 7.10.3 allows SSRF.,MEDIUM,LOW,CVSS:3.1/AV:N/AC:L/PR:L/UI:N/S:U/C:H/I:N/A:N,CWE-918,"https://packetstormsecurity.com/files/158070/OX-App-Suite-OX-Documents-7.10.3-XSS-SSRF-Improper-Validation.html, https://www.open-xchange.com/, https://packetstormsecurity.com/files/158070/OX-App-Suite-OX-Documents-7.10.3-XSS-SSRF-Improper-Validation.html, https://www.open-xchange.com/",External SSRF,"Restrict internal network access, validate user input, use allowlists for URLs"
CVE-2019-20872,"An issue was discovered in Mattermost Server before 5.9.0, 5.8.1, 5.7.3, and 4.10.8. SSRF can attack local services.",MEDIUM,LOW,CVSS:3.1/AV:L/AC:L/PR:L/UI:N/S:U/C:H/I:N/A:N,CWE-918,"https://mattermost.com/security-updates/, https://mattermost.com/security-updates/",External SSRF,"Restrict internal network access, validate user input, use allowlists for URLs"
CVE-2020-13484,"Bitrix24 through 20.0.975 allows SSRF via an intranet IP address in the services/main/ajax.php?action=attachUrlPreview url parameter, if the destination URL hosts an HTML document containing '<meta name=""og:image"" content=""' followed by an intranet URL.",CRITICAL,LOW,CVSS:3.1/AV:N/AC:L/PR:N/UI:N/S:U/C:H/I:H/A:H,CWE-918,"https://gist.github.com/mariuszpoplwski/f261a4bc06adde5c78760559db9d63bd, https://gist.github.com/mariuszpoplwski/f261a4bc06adde5c78760559db9d63bd",External SSRF,"Restrict internal network access, validate user input, use allowlists for URLs"
CVE-2020-13788,Harbor prior to 2.0.1 allows SSRF with this limitation: an attacker with the ability to edit projects can scan ports of hosts accessible on the Harbor server's intranet.,MEDIUM,LOW,CVSS:3.1/AV:N/AC:L/PR:L/UI:N/S:U/C:L/I:N/A:N,CWE-918,"https://github.com/goharbor/harbor/releases, https://www.soluble.ai/blog/harbor-ssrf-cve-2020-13788, https://www.youtube.com/watch?v=v8Isqy4yR3Q, https://github.com/goharbor/harbor/releases, https://www.soluble.ai/blog/harbor-ssrf-cve-2020-13788, https://www.youtube.com/watch?v=v8Isqy4yR3Q",External SSRF,"Restrict internal network access, validate user input, use allowlists for URLs"
CVE-2020-15879,"Bitwarden Server 1.35.1 allows SSRF because it does not consider certain IPv6 addresses (ones beginning with fc, fd, fe, or ff, and the :: address) and certain IPv4 addresses (0.0.0.0/8, 127.0.0.0/8, and 169.254.0.0/16).",HIGH,LOW,CVSS:3.1/AV:N/AC:L/PR:N/UI:N/S:U/C:H/I:N/A:N,CWE-918,"https://github.com/bitwarden/server/pull/827, https://github.com/bitwarden/server/pull/827",Internal SSRF,"Restrict internal network access, validate user input, use allowlists for URLs"
CVE-2020-15819,JetBrains YouTrack before 2020.2.10643 was vulnerable to SSRF that allowed scanning internal ports.,MEDIUM,LOW,CVSS:3.1/AV:N/AC:L/PR:N/UI:N/S:U/C:L/I:N/A:N,CWE-918,"https://blog.jetbrains.com, https://blog.jetbrains.com/blog/2020/08/06/jetbrains-security-bulletin-q2-2020/, https://blog.jetbrains.com, https://blog.jetbrains.com/blog/2020/08/06/jetbrains-security-bulletin-q2-2020/",Internal SSRF,"Restrict internal network access, validate user input, use allowlists for URLs"
CVE-2020-15823,JetBrains YouTrack before 2020.2.8873 is vulnerable to SSRF in the Workflow component.,HIGH,LOW,CVSS:3.1/AV:N/AC:L/PR:N/UI:N/S:U/C:H/I:N/A:N,CWE-918,"https://blog.jetbrains.com, https://blog.jetbrains.com/blog/2020/08/06/jetbrains-security-bulletin-q2-2020/, https://blog.jetbrains.com, https://blog.jetbrains.com/blog/2020/08/06/jetbrains-security-bulletin-q2-2020/",External SSRF,"Restrict internal network access, validate user input, use allowlists for URLs"
CVE-2020-16248,Prometheus Blackbox Exporter through 0.17.0 allows /probe?target= SSRF. NOTE: follow-on discussion suggests that this might plausibly be interpreted as both intended functionality and also a vulnerability,MEDIUM,LOW,CVSS:3.1/AV:N/AC:L/PR:N/UI:N/S:C/C:L/I:N/A:N,CWE-918,"https://github.com/prometheus/blackbox_exporter/issues/669, https://prometheus.io/docs/operating/security/#exporters, https://seclists.org/oss-sec/2020/q3/94, https://www.openwall.com/lists/oss-security/2020/08/08/12, https://www.openwall.com/lists/oss-security/2020/08/08/3, https://github.com/prometheus/blackbox_exporter/issues/669, https://prometheus.io/docs/operating/security/#exporters, https://seclists.org/oss-sec/2020/q3/94, https://www.openwall.com/lists/oss-security/2020/08/08/12, https://www.openwall.com/lists/oss-security/2020/08/08/3",External SSRF,"Restrict internal network access, validate user input, use allowlists for URLs"
CVE-2020-13295,"For GitLab Runner before 13.0.12, 13.1.6, 13.2.3, by replacing dockerd with a malicious server, the Shared Runner is susceptible to SSRF.",MEDIUM,LOW,CVSS:3.1/AV:N/AC:L/PR:L/UI:N/S:U/C:L/I:L/A:N,CWE-918,"https://gitlab.com/gitlab-org/cves/-/blob/master/2020/CVE-2020-13295.json, https://gitlab.com/gitlab-org/gitlab/-/issues/209096, https://hackerone.com/reports/809248, https://gitlab.com/gitlab-org/cves/-/blob/master/2020/CVE-2020-13295.json, https://gitlab.com/gitlab-org/gitlab/-/issues/209096, https://hackerone.com/reports/809248",External SSRF,"Restrict internal network access, validate user input, use allowlists for URLs"
CVE-2020-8226,A vulnerability exists in phpBB <v3.2.10 and <v3.3.1 which allowed remote image dimensions check to be used to SSRF.,MEDIUM,LOW,CVSS:3.1/AV:N/AC:L/PR:N/UI:N/S:C/C:L/I:N/A:N,CWE-610,"https://www.phpbb.com/community/viewtopic.php?f=14&t=2562631, https://www.phpbb.com/community/viewtopic.php?f=14&t=2562636, https://www.phpbb.com/community/viewtopic.php?f=14&t=2562631, https://www.phpbb.com/community/viewtopic.php?f=14&t=2562636",External SSRF,Use request signing to verify authenticity before processing external URLs
CVE-2020-24548,"Ericom Access Server 9.2.0 (for AccessNow and Ericom Blaze) allows SSRF to make outbound WebSocket connection requests on arbitrary TCP ports, and provides ""Cannot connect to"" error messages to inform the attacker about closed ports.",MEDIUM,LOW,CVSS:3.1/AV:N/AC:L/PR:N/UI:N/S:U/C:L/I:N/A:N,CWE-918,"http://packetstormsecurity.com/files/158962/Ericom-Access-Server-9.2.0-Server-Side-Request-Forgery.html, https://www.youtube.com/watch?v=oDTd-yRxVJ0, http://packetstormsecurity.com/files/158962/Ericom-Access-Server-9.2.0-Server-Side-Request-Forgery.html, https://www.youtube.com/watch?v=oDTd-yRxVJ0",External SSRF,"Restrict internal network access, validate user input, use allowlists for URLs"
CVE-2020-24898,"The Table Filter and Charts for Confluence Server app before 5.3.26 (for Atlassian Confluence) allows SSRF via the ""Table from CSV"" macro (URL parameter).",HIGH,LOW,CVSS:3.1/AV:N/AC:L/PR:L/UI:N/S:U/C:H/I:L/A:L,CWE-918,"https://stiltsoft.atlassian.net/browse/VD-1, https://stiltsoft.atlassian.net/browse/VD-1",External SSRF,"Restrict internal network access, validate user input, use allowlists for URLs"
CVE-2020-12644,"OX App Suite 7.10.3 and earlier allows SSRF, related to the mail account API and the /folder/list API.",MEDIUM,LOW,CVSS:3.1/AV:N/AC:L/PR:L/UI:N/S:C/C:L/I:N/A:N,CWE-918,"https://seclists.org/fulldisclosure/2020/Aug/14, https://www.open-xchange.com/, https://exchange.xforce.ibmcloud.com/vulnerabilities/187116, https://seclists.org/fulldisclosure/2020/Aug/14, https://www.open-xchange.com/",External SSRF,"Restrict internal network access, validate user input, use allowlists for URLs"
CVE-2020-13309,"A vulnerability was discovered in GitLab versions before 13.1.10, 13.2.8 and 13.3.4. GitLab was vulnerable to a blind SSRF attack through the repository mirroring feature.",MEDIUM,LOW,CVSS:3.1/AV:N/AC:L/PR:L/UI:N/S:U/C:N/I:L/A:L,CWE-918,"https://gitlab.com/gitlab-org/cves/-/blob/master/2020/CVE-2020-13309.json, https://gitlab.com/gitlab-org/gitlab/-/issues/215879, https://hackerone.com/reports/860196, https://gitlab.com/gitlab-org/cves/-/blob/master/2020/CVE-2020-13309.json, https://gitlab.com/gitlab-org/gitlab/-/issues/215879, https://hackerone.com/reports/860196",Blind SSRF,"Restrict internal network access, validate user input, use allowlists for URLs"
CVE-2020-14029,An issue was discovered in Ozeki NG SMS Gateway through 4.17.6. The RSS To SMS module processes XML files in an unsafe manner. This opens the application to an XML External Entity attack that can be used to perform SSRF or read arbitrary local files.,HIGH,LOW,CVSS:3.1/AV:N/AC:L/PR:N/UI:N/S:U/C:H/I:N/A:N,CWE-611,"http://www.ozeki.hu/index.php?owpn=231, https://github.com/DrunkenShells/Disclosures/tree/master/CVE-2020-14029-XXE-Ozeki%20SMS%20Gateway, http://www.ozeki.hu/index.php?owpn=231, https://github.com/DrunkenShells/Disclosures/tree/master/CVE-2020-14029-XXE-Ozeki%20SMS%20Gateway",External SSRF,Disable XML external entity (XXE) processing to prevent SSRF exploitation
CVE-2020-16171,An issue was discovered in Acronis Cyber Backup before 12.5 Build 16342. Some API endpoints on port 9877 under /api/ams/ accept an additional custom Shard header. The value of this header is afterwards used in a separate web request issued by the application itself. This can be abused to conduct SSRF attacks against otherwise unreachable Acronis services that are bound to localhost such as the NotificationService on 127.0.0.1:30572.,MEDIUM,LOW,CVSS:3.1/AV:N/AC:L/PR:N/UI:N/S:U/C:L/I:L/A:N,CWE-918,"http://seclists.org/fulldisclosure/2020/Sep/33, https://www.rcesecurity.com/2020/09/CVE-2020-16171-Exploiting-Acronis-Cyber-Backup-for-Fun-and-Emails/, http://seclists.org/fulldisclosure/2020/Sep/33, https://www.rcesecurity.com/2020/09/CVE-2020-16171-Exploiting-Acronis-Cyber-Backup-for-Fun-and-Emails/",Internal SSRF,"Restrict internal network access, validate user input, use allowlists for URLs"
CVE-2020-14023,Ozeki NG SMS Gateway through 4.17.6 allows SSRF via SMS WCF or RSS To SMS.,MEDIUM,LOW,CVSS:3.1/AV:N/AC:L/PR:H/UI:N/S:U/C:N/I:N/A:H,CWE-918,"https://github.com/DrunkenShells/Disclosures/tree/master/CVE-2020-14023-Server%20Side%20Request%20Forgery-Ozeki%20SMS%20Gateway, https://www.ozeki.hu/index.php?owpn=231, https://github.com/DrunkenShells/Disclosures/tree/master/CVE-2020-14023-Server%20Side%20Request%20Forgery-Ozeki%20SMS%20Gateway, https://www.ozeki.hu/index.php?owpn=231",External SSRF,"Restrict internal network access, validate user input, use allowlists for URLs"
CVE-2020-15594,An SSRF issue was discovered in Zoho Application Control Plus before version 10.0.511. The mail gateway configuration feature allows an attacker to perform a scan in order to discover open ports on a machine as well as available machines on the network segment on which the instance of the product is deployed.,MEDIUM,LOW,CVSS:3.1/AV:N/AC:L/PR:L/UI:N/S:U/C:L/I:N/A:N,CWE-918,"https://excellium-services.com/cert-xlm-advisory/cve-2020-15594/, https://excellium-services.com/cert-xlm-advisory/cve-2020-15594/",External SSRF,"Restrict internal network access, validate user input, use allowlists for URLs"
CVE-2020-24570,"An issue was discovered in MB CONNECT LINE mymbCONNECT24 and mbCONNECT24 through 2.6.1. There is a CSRF issue (with resultant SSRF) in the com_mb24proxy module, allowing attackers to steal session information from logged-in users with a crafted link.",MEDIUM,LOW,CVSS:3.1/AV:N/AC:L/PR:N/UI:R/S:U/C:H/I:N/A:N,CWE-352,"https://mbconnectline.com/security-advice/, https://mbconnectline.com/security-advice/",External SSRF,"Implement CSRF protection, enforce SameSite cookies, and use CSRF tokens"
