CVE ID,Description,Severity,Attack Complexity,Attack Vector,CWE ID,References,Attack Type,Mitigation Strategy
CVE-2014-9304,"Plex Media Server before 0.9.9.3 allows remote attackers to bypass the web server whitelist, conduct SSRF attacks, and execute arbitrary administrative actions via multiple crafted X-Plex-Url headers to system/proxy, which are inconsistently processed by the request handler in the backend web server.",N/A,N/A,N/A,CWE-264,"http://www.securityfocus.com/archive/1/531290, https://forums.plex.tv/index.php/topic/62832-plex-media-server/?p=583250, https://www.sec-consult.com/fxdata/seccons/prod/temedia/advisories_txt/20140228-1_Plex_Media_Server_Authentication_bypass_local_file_disclosure_v10.txt, http://www.securityfocus.com/archive/1/531290, https://forums.plex.tv/index.php/topic/62832-plex-media-server/?p=583250, https://www.sec-consult.com/fxdata/seccons/prod/temedia/advisories_txt/20140228-1_Plex_Media_Server_Authentication_bypass_local_file_disclosure_v10.txt",External SSRF,Implement least privilege access control for all network services
CVE-2014-6577,"Unspecified vulnerability in the XML Developer's Kit for C component in Oracle Database Server 11.2.0.3, 11.2.0.4, 12.1.0.1, and 12.1.0.2 allows remote authenticated users to affect confidentiality via unknown vectors.  NOTE: the previous information is from the January 2015 CPU. Oracle has not commented on the original researcher's claim that this is an XML external entity (XXE) vulnerability in the XML parser, which allows attackers to conduct internal port scanning, perform SSRF attacks, or cause a denial of service via a crafted (1) http: or (2) ftp: URI.",N/A,N/A,N/A,NVD-CWE-noinfo,"http://www.oracle.com/technetwork/topics/security/cpujan2015-1972971.html, http://www.securityfocus.com/bid/72139, http://www.securitytracker.com/id/1031572, https://blog.netspi.com/advisory-xxe-injection-oracle-database-cve-2014-6577/, http://www.oracle.com/technetwork/topics/security/cpujan2015-1972971.html, http://www.securityfocus.com/bid/72139, http://www.securitytracker.com/id/1031572, https://blog.netspi.com/advisory-xxe-injection-oracle-database-cve-2014-6577/",Internal SSRF,"General SSRF Mitigation: Validate and sanitize all URLs, restrict network access, and enforce security controls."
CVE-2016-4029,"WordPress before 4.5 does not consider octal and hexadecimal IP address formats when determining an intranet address, which allows remote attackers to bypass an intended SSRF protection mechanism via a crafted address.",HIGH,LOW,CVSS:3.1/AV:N/AC:L/PR:N/UI:N/S:C/C:N/I:H/A:N,CWE-918,"http://codex.wordpress.org/Version_4.5, http://www.debian.org/security/2016/dsa-3681, http://www.securitytracker.com/id/1036594, https://core.trac.wordpress.org/query?status=closed&milestone=4.5, https://wpvulndb.com/vulnerabilities/8473, http://codex.wordpress.org/Version_4.5, http://www.debian.org/security/2016/dsa-3681, http://www.securitytracker.com/id/1036594, https://core.trac.wordpress.org/query?status=closed&milestone=4.5, https://wpvulndb.com/vulnerabilities/8473",External SSRF,"Restrict internal network access, validate user input, use allowlists for URLs"
CVE-2016-6483,"The media-file upload feature in vBulletin before 3.8.7 Patch Level 6, 3.8.8 before Patch Level 2, 3.8.9 before Patch Level 1, 4.x before 4.2.2 Patch Level 6, 4.2.3 before Patch Level 2, 5.x before 5.2.0 Patch Level 3, 5.2.1 before Patch Level 1, and 5.2.2 before Patch Level 1 allows remote attackers to conduct SSRF attacks via a crafted URL that results in a Redirection HTTP status code.",N/A,N/A,N/A,CWE-918,"http://legalhackers.com/advisories/vBulletin-SSRF-Vulnerability-Exploit.txt, http://www.securityfocus.com/bid/92350, http://www.securitytracker.com/id/1036553, http://www.vbulletin.com/forum/forum/vbulletin-announcements/vbulletin-announcements_aa/4349548-security-patch-vbulletin-3-8-7-3-8-8-3-8-9-3-8-10-beta, http://www.vbulletin.com/forum/forum/vbulletin-announcements/vbulletin-announcements_aa/4349549-security-patch-vbulletin-4-2-2-4-2-3-4-2-4-beta, http://www.vbulletin.com/forum/forum/vbulletin-announcements/vbulletin-announcements_aa/4349551-security-patch-vbulletin-5-2-0-5-2-1-5-2-2, https://www.exploit-db.com/exploits/40225/, http://legalhackers.com/advisories/vBulletin-SSRF-Vulnerability-Exploit.txt, http://www.securityfocus.com/bid/92350, http://www.securitytracker.com/id/1036553, http://www.vbulletin.com/forum/forum/vbulletin-announcements/vbulletin-announcements_aa/4349548-security-patch-vbulletin-3-8-7-3-8-8-3-8-9-3-8-10-beta, http://www.vbulletin.com/forum/forum/vbulletin-announcements/vbulletin-announcements_aa/4349549-security-patch-vbulletin-4-2-2-4-2-3-4-2-4-beta, http://www.vbulletin.com/forum/forum/vbulletin-announcements/vbulletin-announcements_aa/4349551-security-patch-vbulletin-5-2-0-5-2-1-5-2-2, https://www.exploit-db.com/exploits/40225/",External SSRF,"Restrict internal network access, validate user input, use allowlists for URLs"
CVE-2016-7964,"The sendRequest method in HTTPClient Class in file /inc/HTTPClient.php in DokuWiki 2016-06-26a and older, when media file fetching is enabled, has no way to restrict access to private networks. This allows users to scan ports of internal networks via SSRF, such as 10.0.0.1/8, 172.16.0.0/12, and 192.168.0.0/16.",N/A,N/A,N/A,CWE-918,"http://www.securityfocus.com/bid/94245, https://github.com/splitbrain/dokuwiki/issues/1708, http://www.securityfocus.com/bid/94245, https://github.com/splitbrain/dokuwiki/issues/1708",Internal SSRF,"Restrict internal network access, validate user input, use allowlists for URLs"
CVE-2016-5968,"The Replay Server in IBM Tealeaf Customer Experience 8.x before 8.7.1.8847 FP10, 8.8.x before 8.8.0.9049 FP9, 9.0.0 and 9.0.1 before 9.0.1.1117 FP5, 9.0.1A before 9.0.1.5108 FP5, 9.0.2 before 9.0.2.1223 FP3, and 9.0.2A before 9.0.2.5224 FP3 allows remote attackers to conduct SSRF attacks via unspecified vectors.",N/A,N/A,N/A,CWE-918,"http://www-01.ibm.com/support/docview.wss?uid=swg21989374, http://www.securityfocus.com/bid/94516, http://www-01.ibm.com/support/docview.wss?uid=swg21989374, http://www.securityfocus.com/bid/94516",External SSRF,"Restrict internal network access, validate user input, use allowlists for URLs"
CVE-2016-9752,"In Serendipity before 2.0.5, an attacker can bypass SSRF protection by using a malformed IP address (e.g., http://127.1) or a 30x (aka Redirection) HTTP status code.",N/A,N/A,N/A,CWE-918,"http://www.securityfocus.com/bid/94622, https://blog.s9y.org/archives/271-Serendipity-2.0.5-and-2.1-beta3-released.html, https://github.com/s9y/Serendipity/commit/fbdd50a448ed87ba34ea8c56446b8f1873eadd6f, http://www.securityfocus.com/bid/94622, https://blog.s9y.org/archives/271-Serendipity-2.0.5-and-2.1-beta3-released.html, https://github.com/s9y/Serendipity/commit/fbdd50a448ed87ba34ea8c56446b8f1873eadd6f",External SSRF,"Restrict internal network access, validate user input, use allowlists for URLs"
CVE-2017-5518,"The media-file upload feature in GeniXCMS through 0.0.8 allows remote attackers to conduct SSRF attacks via a URL, as demonstrated by a URL with an intranet IP address.",N/A,N/A,N/A,CWE-918,"http://www.securityfocus.com/bid/95462, https://github.com/semplon/GeniXCMS/issues/64, http://www.securityfocus.com/bid/95462, https://github.com/semplon/GeniXCMS/issues/64",External SSRF,"Restrict internal network access, validate user input, use allowlists for URLs"
CVE-2017-5643,Apache Camel's Validation Component is vulnerable against SSRF via remote DTDs and XXE.,N/A,N/A,N/A,CWE-918,"http://camel.apache.org/security-advisories.data/CVE-2017-5643.txt.asc?version=1&modificationDate=1489652454000&api=v2, http://www.securityfocus.com/bid/97226, https://access.redhat.com/errata/RHSA-2017:1832, https://lists.apache.org/thread.html/2318d7f7d87724d8716cd650c21b31cb06e4d34f6d0f5ee42f28fdaf%40%3Ccommits.camel.apache.org%3E, https://lists.apache.org/thread.html/b4014ea7c5830ca1fc28edd5cafedfe93ad4af2d9e69c961c5def31d%40%3Ccommits.camel.apache.org%3E, http://camel.apache.org/security-advisories.data/CVE-2017-5643.txt.asc?version=1&modificationDate=1489652454000&api=v2, http://www.securityfocus.com/bid/97226, https://access.redhat.com/errata/RHSA-2017:1832, https://lists.apache.org/thread.html/2318d7f7d87724d8716cd650c21b31cb06e4d34f6d0f5ee42f28fdaf%40%3Ccommits.camel.apache.org%3E, https://lists.apache.org/thread.html/b4014ea7c5830ca1fc28edd5cafedfe93ad4af2d9e69c961c5def31d%40%3Ccommits.camel.apache.org%3E",External SSRF,"Restrict internal network access, validate user input, use allowlists for URLs"
CVE-2017-7200,"An SSRF issue was discovered in OpenStack Glance before Newton. The 'copy_from' feature in the Image Service API v1 allowed an attacker to perform masked network port scans. With v1, it is possible to create images with a URL such as 'http://localhost:22'. This could then allow an attacker to enumerate internal network details while appearing masked, since the scan would appear to originate from the Glance Image service.",N/A,N/A,N/A,CWE-918,"http://www.securityfocus.com/bid/96988, https://bugs.launchpad.net/ossn/+bug/1153614, https://bugs.launchpad.net/ossn/+bug/1606495, https://wiki.openstack.org/wiki/OSSN/OSSN-0078, http://www.securityfocus.com/bid/96988, https://bugs.launchpad.net/ossn/+bug/1153614, https://bugs.launchpad.net/ossn/+bug/1606495, https://wiki.openstack.org/wiki/OSSN/OSSN-0078",Internal SSRF,"Restrict internal network access, validate user input, use allowlists for URLs"
CVE-2017-7272,"PHP through 7.1.11 enables potential SSRF in applications that accept an fsockopen or pfsockopen hostname argument with an expectation that the port number is constrained. Because a :port syntax is recognized, fsockopen will use the port number that is specified in the hostname argument, instead of the port number in the second argument of the function.",N/A,N/A,N/A,CWE-918,"http://www.securityfocus.com/bid/97178, http://www.securitytracker.com/id/1038158, https://bugs.php.net/bug.php?id=74216, https://bugs.php.net/bug.php?id=75505, https://github.com/php/php-src/commit/bab0b99f376dac9170ac81382a5ed526938d595a, https://security.netapp.com/advisory/ntap-20180112-0001/, https://www.sec-consult.com/fxdata/seccons/prod/temedia/advisories_txt/20170403-0_PHP_Misbehavior_of_fsockopen_function_v10.txt, http://www.securityfocus.com/bid/97178, http://www.securitytracker.com/id/1038158, https://bugs.php.net/bug.php?id=74216, https://bugs.php.net/bug.php?id=75505, https://github.com/php/php-src/commit/bab0b99f376dac9170ac81382a5ed526938d595a, https://security.netapp.com/advisory/ntap-20180112-0001/, https://www.sec-consult.com/fxdata/seccons/prod/temedia/advisories_txt/20170403-0_PHP_Misbehavior_of_fsockopen_function_v10.txt",DNS Rebinding SSRF,"Restrict internal network access, validate user input, use allowlists for URLs"
CVE-2017-7566,MyBB before 1.8.11 allows remote attackers to bypass an SSRF protection mechanism.,N/A,N/A,N/A,CWE-918,"http://www.securityfocus.com/bid/97480, https://blog.mybb.com/2017/04/04/mybb-1-8-11-merge-system-1-8-11-release/, https://github.com/mybb/mybb/commit/f5de8fc2aad11e0d2583f585535ccfa2b46325db#diff-7fe6e55397c77ab9a0f5d57bc4cbe5b9R6781, https://www.sec-consult.com/fxdata/seccons/prod/temedia/advisories_txt/20170407-0_MyBB_SSRF_vulnerability_v10.txt, http://www.securityfocus.com/bid/97480, https://blog.mybb.com/2017/04/04/mybb-1-8-11-merge-system-1-8-11-release/, https://github.com/mybb/mybb/commit/f5de8fc2aad11e0d2583f585535ccfa2b46325db#diff-7fe6e55397c77ab9a0f5d57bc4cbe5b9R6781, https://www.sec-consult.com/fxdata/seccons/prod/temedia/advisories_txt/20170407-0_MyBB_SSRF_vulnerability_v10.txt",External SSRF,"Restrict internal network access, validate user input, use allowlists for URLs"
CVE-2017-7569,"In vBulletin before 5.3.0, remote attackers can bypass the CVE-2016-6483 patch and conduct SSRF attacks by leveraging the behavior of the PHP parse_url function, aka VBV-17037.",N/A,N/A,N/A,CWE-918,"https://www.vbulletin.com/forum/forum/vbulletin-announcements/vbulletin-announcements_aa/4367744-vbulletin-5-3-0-connect-is-now-available, https://www.vbulletin.com/forum/forum/vbulletin-announcements/vbulletin-announcements_aa/4367744-vbulletin-5-3-0-connect-is-now-available",External SSRF,"Restrict internal network access, validate user input, use allowlists for URLs"
CVE-2017-8794,"An issue was discovered on Accellion FTA devices before FTA_9_12_180. Because a regular expression (intended to match local https URLs) lacks an initial ^ character, courier/web/1000@/wmProgressval.html allows SSRF attacks with a file:///etc/passwd#https:// URL pattern.",N/A,N/A,N/A,CWE-918,"https://gist.github.com/anonymous/32e2894fa29176f3f32cb2b2bb7c24cb, https://gist.github.com/anonymous/32e2894fa29176f3f32cb2b2bb7c24cb",Protocol Abuse SSRF,"Restrict internal network access, validate user input, use allowlists for URLs"
CVE-2017-9066,"In WordPress before 4.7.5, there is insufficient redirect validation in the HTTP class, leading to SSRF.",N/A,N/A,N/A,CWE-918,"http://www.securityfocus.com/bid/98509, http://www.securitytracker.com/id/1038520, https://codex.wordpress.org/Version_4.7.5, https://github.com/WordPress/WordPress/commit/76d77e927bb4d0f87c7262a50e28d84e01fd2b11, https://twitter.com/skansing/status/865362551097393153, https://wordpress.org/news/2017/05/wordpress-4-7-5/, https://wpvulndb.com/vulnerabilities/8815, https://www.debian.org/security/2018/dsa-4090, http://www.securityfocus.com/bid/98509, http://www.securitytracker.com/id/1038520, https://codex.wordpress.org/Version_4.7.5, https://github.com/WordPress/WordPress/commit/76d77e927bb4d0f87c7262a50e28d84e01fd2b11, https://twitter.com/skansing/status/865362551097393153, https://wordpress.org/news/2017/05/wordpress-4-7-5/, https://wpvulndb.com/vulnerabilities/8815, https://www.debian.org/security/2018/dsa-4090",External SSRF,"Restrict internal network access, validate user input, use allowlists for URLs"
CVE-2017-7503,"It was found that the Red Hat JBoss EAP 7.0.5 implementation of javax.xml.transform.TransformerFactory is vulnerable to XXE. An attacker could use this flaw to launch DoS or SSRF attacks, or read files from the server where EAP is deployed.",N/A,N/A,N/A,CWE-611,"http://www.securityfocus.com/bid/98546, https://bugzilla.redhat.com/show_bug.cgi?id=1451960, http://www.securityfocus.com/bid/98546, https://bugzilla.redhat.com/show_bug.cgi?id=1451960",External SSRF,Disable XML external entity (XXE) processing to prevent SSRF exploitation
CVE-2017-9307,SSRF vulnerability in remotedownload.php in Allen Disk 1.6 allows remote authenticated users to conduct port scans and access intranet servers via a crafted file parameter.,N/A,N/A,N/A,CWE-918,"https://github.com/s3131212/allendisk/issues/20, https://github.com/s3131212/allendisk/issues/20",External SSRF,"Restrict internal network access, validate user input, use allowlists for URLs"
CVE-2017-10973,"In FineCMS before 2017-07-06, application/lib/ajax/get_image_data.php has SSRF, related to requests for non-image files with a modified HTTP Host header.",N/A,N/A,N/A,CWE-918,"https://github.com/andrzuk/FineCMS/pull/10, https://github.com/andrzuk/FineCMS/pull/11, https://github.com/andrzuk/FineCMS/pull/10, https://github.com/andrzuk/FineCMS/pull/11",External SSRF,"Restrict internal network access, validate user input, use allowlists for URLs"
CVE-2017-14759,"OpenText Document Sciences xPression (formerly EMC Document Sciences xPression) v4.5SP1 Patch 13 (older versions might be affected as well) is prone to an XML External Entity vulnerability: /xFramework/services/QuickDoc.QuickDocHttpSoap11Endpoint/. An unauthenticated user is able to read directory listings or system files, or cause SSRF or Denial of Service.",N/A,N/A,N/A,CWE-611,"http://seclists.org/fulldisclosure/2017/Sep/97, https://knowledge.opentext.com/knowledge/llisapi.dll/Open/68982774, http://seclists.org/fulldisclosure/2017/Sep/97, https://knowledge.opentext.com/knowledge/llisapi.dll/Open/68982774",External SSRF,Disable XML external entity (XXE) processing to prevent SSRF exploitation
CVE-2017-15280,"XML external entity (XXE) vulnerability in Umbraco CMS before 7.7.3 allows attackers to obtain sensitive information by reading files on the server or sending TCP requests to intranet hosts (aka SSRF), related to Umbraco.Web/umbraco.presentation/umbraco/dialogs/importDocumenttype.aspx.cs.",N/A,N/A,N/A,CWE-611,"http://issues.umbraco.org/issue/U4-10506, https://github.com/umbraco/Umbraco-CMS/commit/5dde2efe0d2b3a47d17439e03acabb7ea2befb64, http://issues.umbraco.org/issue/U4-10506, https://github.com/umbraco/Umbraco-CMS/commit/5dde2efe0d2b3a47d17439e03acabb7ea2befb64",External SSRF,Disable XML external entity (XXE) processing to prevent SSRF exploitation
CVE-2017-15644,"SSRF exists in Webmin 1.850 via the PATH_INFO to tunnel/link.cgi, as demonstrated by a GET request for tunnel/link.cgi/http://INTRANET-IP:8000.",N/A,N/A,N/A,CWE-918,"http://www.webmin.com/changes.html, http://www.webmin.com/security.html, https://blogs.securiteam.com/index.php/archives/3430, https://github.com/webmin/webmin/commit/0c58892732ee7610a7abba5507614366d382c9c9, http://www.webmin.com/changes.html, http://www.webmin.com/security.html, https://blogs.securiteam.com/index.php/archives/3430, https://github.com/webmin/webmin/commit/0c58892732ee7610a7abba5507614366d382c9c9",External SSRF,"Restrict internal network access, validate user input, use allowlists for URLs"
CVE-2017-16870,The UpdraftPlus plugin through 1.13.12 for WordPress has SSRF in the updraft_ajax_handler function in /wp-content/plugins/updraftplus/admin.php via an httpget subaction. NOTE: the vendor reports that this does not cross a privilege boundary,N/A,N/A,N/A,CWE-918,"https://github.com/LoRexxar/CVE_Request/tree/master/wordpress%20plugin%20updraftplus%20vulnerablity#authenticated-ssrf, https://github.com/LoRexxar/CVE_Request/tree/master/wordpress%20plugin%20updraftplus%20vulnerablity#authenticated-ssrf",External SSRF,"Restrict internal network access, validate user input, use allowlists for URLs"
CVE-2017-4928,"The flash-based vSphere Web Client (6.0 prior to 6.0 U3c and 5.5 prior to 5.5 U3f) i.e. not the new HTML5-based vSphere Client, contains SSRF and CRLF injection issues due to improper neutralization of URLs. An attacker may exploit these issues by sending a POST request with modified headers towards internal services leading to information disclosure.",N/A,N/A,N/A,CWE-352,"http://www.securityfocus.com/bid/101785, http://www.securitytracker.com/id/1039759, https://www.vmware.com/security/advisories/VMSA-2017-0017.html, http://www.securityfocus.com/bid/101785, http://www.securitytracker.com/id/1039759, https://www.vmware.com/security/advisories/VMSA-2017-0017.html",Internal SSRF,"Implement CSRF protection, enforce SameSite cookies, and use CSRF tokens"
CVE-2017-1000190,"SimpleXML (latest version 2.7.1) is vulnerable to an XXE vulnerability resulting SSRF, information disclosure, DoS and so on.",N/A,N/A,N/A,CWE-611,"https://github.com/ngallagher/simplexml/issues/18, https://lists.apache.org/thread.html/708d94141126eac03011144a971a6411fcac16d9c248d1d535a39451%40%3Csolr-user.lucene.apache.org%3E, https://lists.apache.org/thread.html/8c4ef27e2c0218f29e785990dc919266855aea137c958f10d242cb36%40%3Cdev.lucene.apache.org%3E, https://lists.apache.org/thread.html/r204ba2a9ea750f38d789d2bb429cc0925ad6133deea7cbc3001d96b5%40%3Csolr-user.lucene.apache.org%3E, https://github.com/ngallagher/simplexml/issues/18, https://lists.apache.org/thread.html/708d94141126eac03011144a971a6411fcac16d9c248d1d535a39451%40%3Csolr-user.lucene.apache.org%3E, https://lists.apache.org/thread.html/8c4ef27e2c0218f29e785990dc919266855aea137c958f10d242cb36%40%3Cdev.lucene.apache.org%3E, https://lists.apache.org/thread.html/r204ba2a9ea750f38d789d2bb429cc0925ad6133deea7cbc3001d96b5%40%3Csolr-user.lucene.apache.org%3E",External SSRF,Disable XML external entity (XXE) processing to prevent SSRF exploitation
CVE-2017-17697,The Ping() function in ui/api/target.go in Harbor through 1.3.0-rc4 has SSRF via the endpoint parameter to /api/targets/ping.,HIGH,LOW,CVSS:3.1/AV:N/AC:L/PR:N/UI:N/S:C/C:H/I:N/A:N,CWE-918,"https://github.com/vmware/harbor/issues/3755, https://github.com/vmware/harbor/issues/3755",External SSRF,"Restrict internal network access, validate user input, use allowlists for URLs"
CVE-2017-1000419,"phpBB version 3.2.0 is vulnerable to SSRF in the Remote Avatar function resulting allowing an attacker to perform port scanning, requesting internal content and potentially attacking such internal services via the web application.",N/A,N/A,N/A,CWE-918,"https://www.phpbb.com/community/viewtopic.php?f=14&p=14782136, https://www.sec-consult.com/en/blog/advisories/phpbb-server-side-request-forgery-vulnerability/index.html, https://www.phpbb.com/community/viewtopic.php?f=14&p=14782136, https://www.sec-consult.com/en/blog/advisories/phpbb-server-side-request-forgery-vulnerability/index.html",Internal SSRF,"Restrict internal network access, validate user input, use allowlists for URLs"
CVE-2018-6186,"Citrix NetScaler VPX through NS12.0 53.13.nc allows an SSRF attack via the /rapi/read_url URI by an authenticated attacker who has a webapp account. The attacker can gain access to the nsroot account, and execute remote commands with root privileges.",N/A,N/A,N/A,CWE-918,"http://www.securityfocus.com/bid/102915, http://www.securitytracker.com/id/1040440, https://gist.github.com/buxu/04ce809eb8b32ef57e232eab5e61f023, https://support.citrix.com/article/CTX232161, http://www.securityfocus.com/bid/102915, http://www.securitytracker.com/id/1040440, https://gist.github.com/buxu/04ce809eb8b32ef57e232eab5e61f023, https://support.citrix.com/article/CTX232161",External SSRF,"Restrict internal network access, validate user input, use allowlists for URLs"
CVE-2018-7055,GroupViewProxyServlet in RoomWizard before 4.4.x allows SSRF via the url parameter.,N/A,N/A,N/A,CWE-918,"http://misteralfa-hack.blogspot.cl/2018/02/steelcase-sala-por-favor-y-todos-tus.html, http://misteralfa-hack.blogspot.cl/2018/02/steelcase-sala-por-favor-y-todos-tus.html",External SSRF,"Restrict internal network access, validate user input, use allowlists for URLs"
CVE-2018-7667,Adminer through 4.3.1 has SSRF via the server parameter.,N/A,N/A,N/A,CWE-918,"http://hyp3rlinx.altervista.org/advisories/ADMINER-UNAUTHENTICATED-SERVER-SIDE-REQUEST-FORGERY.txt, https://lists.debian.org/debian-lts-announce/2018/03/msg00014.html, http://hyp3rlinx.altervista.org/advisories/ADMINER-UNAUTHENTICATED-SERVER-SIDE-REQUEST-FORGERY.txt, https://lists.debian.org/debian-lts-announce/2018/03/msg00014.html",External SSRF,"Restrict internal network access, validate user input, use allowlists for URLs"
CVE-2018-1000124,I Librarian I-librarian version 4.8 and earlier contains a XML External Entity (XXE) vulnerability in line 154 of importmetadata.php(simplexml_load_string) that can result in an attacker reading the contents of a file and SSRF. This attack appear to be exploitable via posting xml in the Parameter form_import_textarea.,N/A,N/A,N/A,CWE-611,"https://github.com/mkucej/i-librarian/issues/116, https://github.com/mkucej/i-librarian/issues/116",Internal SSRF,Disable XML external entity (XXE) processing to prevent SSRF exploitation
CVE-2018-1000138,"I, Librarian version 4.8 and earlier contains a SSRF vulnerability in ""url"" parameter of getFromWeb in functions.php that can result in the attacker abusing functionality on the server to read or update internal resources.",N/A,N/A,N/A,CWE-918,"https://github.com/mkucej/i-librarian/blob/9535753a84bc615b210802d4c9542db73368d984/functions.php#L811, https://github.com/mkucej/i-librarian/issues/120, https://github.com/mkucej/i-librarian/blob/9535753a84bc615b210802d4c9542db73368d984/functions.php#L811, https://github.com/mkucej/i-librarian/issues/120",Internal SSRF,"Restrict internal network access, validate user input, use allowlists for URLs"
CVE-2017-16614,"SSRF (Server Side Request Forgery) in tpshop 2.0.5 and 2.0.6 allows remote attackers to obtain sensitive information, attack intranet hosts, or possibly trigger remote command execution via the plugins/payment/weixin/lib/WxPay.tedatac.php fBill parameter.",N/A,N/A,N/A,CWE-918,"http://seclists.org/fulldisclosure/2018/Mar/77, http://seclists.org/fulldisclosure/2018/Mar/77",External SSRF,"Restrict internal network access, validate user input, use allowlists for URLs"
CVE-2017-14323,"SSRF (Server Side Request Forgery) in getRemoteImage.php in Ueditor in Onethink V1.0 and V1.1 allows remote attackers to obtain sensitive information, attack intranet hosts, or possibly trigger remote command execution via the upfile parameter.",N/A,N/A,N/A,CWE-918,"http://seclists.org/fulldisclosure/2018/Apr/16, http://seclists.org/fulldisclosure/2018/Apr/16",External SSRF,"Restrict internal network access, validate user input, use allowlists for URLs"
CVE-2017-14611,"SSRF (Server Side Request Forgery) in Cockpit 0.13.0 allows remote attackers to read arbitrary files or send TCP traffic to intranet hosts via the url parameter, related to use of the discontinued aheinze/fetch_url_contents component.",N/A,N/A,N/A,CWE-918,"http://seclists.org/fulldisclosure/2018/Apr/15, http://seclists.org/fulldisclosure/2018/Apr/15",External SSRF,"Restrict internal network access, validate user input, use allowlists for URLs"
CVE-2018-10220,"Glastopf 3.1.3-dev has SSRF, as demonstrated by the abc.php a parameter. NOTE: the vendor indicates that this is intentional behavior because the product is a web application honeypot, and modules/handlers/emulators/rfi.py supports Remote File Inclusion emulation",N/A,N/A,N/A,CWE-918,"https://github.com/mushorg/glastopf/issues/286, https://github.com/mushorg/glastopf/issues/286",External SSRF,"Restrict internal network access, validate user input, use allowlists for URLs"
